[
    {
        "task": 0,
        "model": "qwen3-vl-flash",
        "dur": 104.02299618721008,
        "step": 18,
        "result": {
            "firstName": "Nicholas",
            "middleName": "Anne",
            "lastName": "Collins",
            "studentId": 22281229,
            "gpa": 3.19,
            "major": "Philosophy",
            "academicYear": "sophomore",
            "financialAid": "Other Scholarships",
            "familyIncome": 80303,
            "achievements": [
                "Dean's List Award for Outstanding Academic Performance",
                " Winner of the State Physics Olympiad"
            ],
            "extracurricular": [
                "Co-founder of the Campus Startup Initiative",
                " where I work with fellow students to foster innovation and entrepreneurship on campus. President of the Student Council",
                " advocating for peers and promoting unity. Volunteer at the local community center and Coordinator of the Youth Empowerment Program",
                " mentoring and supporting at-risk youth."
            ],
            "essay": "Dear Scholarship Selection Committee,\r\n\r\nMy name is Nicholas Anne Collins, and I am a sophomore majoring in Philosophy at your esteemed institution. I am writing to express my sincere interest in applying for the scholarship opportunity available to students in need of financial assistance.\r\n\r\nAs a first-generation college student, I have worked hard to maintain a GPA of 3.19 while balancing my academic studies with various extracurricular activities. I am the proud recipient of the Dean's List Award for Outstanding Academic Performance and was also honored to be the winner of the State Physics Olympiad. These achievements are a testament to my dedication to academic excellence and my passion for learning.\r\n\r\nIn addition to my academic accomplishments, I am actively involved in extracurricular activities that allow me to contribute to my community. I am the co-founder of the Campus Startup Initiative, where I work with fellow students to foster innovation and entrepreneurship on campus. I also serve as the President of the Student Council, where I advocate for the needs of my peers and promote a sense of unity within our student body. Furthermore, I volunteer at the local community center and serve as the Coordinator of the Youth Empowerment Program, where I mentor and support at-risk youth in my community.\r\n\r\nDespite my dedication to both my academic studies and extracurricular activities, my family's annual income of $80,303 falls short of covering the cost of my education. I currently receive financial aid from another scholarship, but additional support is needed to alleviate the financial burden on my family and enable me to fully focus on my studies and community service.\r\n\r\nI believe that receiving this scholarship will not only help me achieve my academic and career goals but will also allow me to continue making a positive impact on my community. My ultimate goal is to become a leader in public health, and this scholarship will be instrumental in helping me realize that dream.\r\n\r\nI would be honored to be considered for this scholarship opportunity and am confident that with your support, I will continue to excel academically and make valuable contributions to my community. I have attached the contact information of my academic reference, Kevin Walker, who can attest to my academic abilities and character.\r\n\r\nThank you for considering my application. I look forward to the opportunity to contribute to the campus community and make a difference in the world.\r\n\r\nSincerely,\r\nNicholas Anne Collins\r\nStudent ID: 22281229\r\nEmail: nicholascollins@email.com\r\nPhone: (555) 123-4567\r\nAcademic Reference: Kevin Walker\r\nReference Email: psolomon@yahoo.com",
            "reference1": "",
            "reference1Email": "",
            "submission_time": "2025-11-04 15:07:52"
        }
    },
    {
        "task": 1,
        "model": "qwen3-vl-flash",
        "dur": 97.68126797676086,
        "step": 19,
        "result": {
            "firstName": "Sarah",
            "middleName": "John",
            "lastName": "Rubio",
            "studentId": 39177542,
            "gpa": 3.59,
            "major": "Sociology",
            "academicYear": "freshman",
            "financialAid": "Other Scholarships",
            "familyIncome": 60273,
            "achievements": [
                "First place in University Math Competition",
                " Finalist in National Robotics Championship",
                " Published research paper in the International Journal of Engineering"
            ],
            "extracurricular": [
                "Co-founder of Campus Startup Initiative",
                " Organized charity events for Red Cross"
            ],
            "essay": "My name is Sarah John Rubio, and I am writing to express my sincere interest in applying for your esteemed scholarship. As a freshman majoring in Sociology at [University Name], I have a current GPA of 3.59, reflecting my strong dedication to academic excellence, which I seek to further enhance with the support of this scholarship. Throughout my academic journey, I have pursued opportunities that not only challenge me but also allow me to contribute positively to my community and the academic field. I am proud to share that I recently achieved first place in the University Math Competition and was a finalist in the National Robotics Championship. Additionally, I have contributed to the academic community by publishing a research paper in the International Journal of Engineering, which has solidified my understanding of complex concepts and my passion for research. However, my academic achievements extend beyond the classroom. I have taken an active role in extracurricular activities that reflect my commitment to social betterment and innovation. As the co-founder of the Campus Startup Initiative, I work collaboratively with peers to foster entrepreneurial skills and promote creative solutions among students. Furthermore, I have organized charity events for the Red Cross, which allowed me to directly contribute to the well-being of those in need and to develop essential leadership and organizational skills. Despite being awarded other scholarships, I face financial constraints, as my family income is $60,273 annually. This scholarship would ease my financial burdens significantly and empower me to focus on my education rather than on financial stress. My ultimate goal is to innovate in the tech industry, where I aspire to explore cutting-edge technologies that can advance our everyday lives. In crafting this scholarship application, I draw upon the recommendation of Nathan Mullins, who has been instrumental in supporting my academic and extracurricular endeavors. You may contact him at danieldavis@kline-townsend.com for any insights regarding my performance and contributions. Thank you for considering my application. With your support, I will have the resources necessary to propel my educational journey further, and ultimately fulfill my long-term aspirations of making a tangible impact in the field of technology.",
            "reference1": "",
            "reference1Email": "",
            "submission_time": "2025-11-04 15:09:32"
        }
    },
    {
        "task": 2,
        "model": "qwen3-vl-flash",
        "dur": 90.4383978843689,
        "step": 18,
        "result": {
            "firstName": "Brian",
            "middleName": "Emily",
            "lastName": "Morrison",
            "studentId": 36546439,
            "gpa": 3.58,
            "major": "English Literature",
            "academicYear": "sophomore",
            "financialAid": "Other Scholarships",
            "familyIncome": 38761,
            "achievements": [
                "I published a research paper in the International Journal of Engineering",
                " which was a significant milestone in my educational path. Additionally",
                " I am proud to have ranked in the top 5% in the International Chemistry Olympiad and to be the winner of the National Science Fair. These achievements highlight my dedication to rigorous academic standards and my enthusiasm for learning."
            ],
            "extracurricular": [
                "As the President of the Student Council",
                " I have had the privilege of representing my peers and collaborating with faculty to improve our academic environment. Additionally",
                " I co-founded the Campus Startup Initiative",
                " creating a platform for innovative students to share and develop their entrepreneurial ideas. I have also coordinated the Youth Empowerment Program and organized charity events for the Red Cross",
                " solidifying my dedication to both leadership and community service."
            ],
            "essay": "I am writing to express my earnest desire to be considered for the scholarship opportunity available for deserving students. My name is Brian Emily Morrison, and I am currently a sophomore pursuing a major in English Literature at [Your University]. With a current GPA of 3.58, I have demonstrated a strong commitment to academic excellence while engaging in various extracurricular activities that cultivate leadership and community involvement. Throughout my academic journey, I have been honored to achieve notable accomplishments. I published a research paper in the International Journal of Engineering, which was a significant milestone in my educational path. Additionally, I am proud to have ranked in the top 5% in the International Chemistry Olympiad and to be the winner of the National Science Fair. These achievements highlight my dedication to rigorous academic standards and my enthusiasm for learning. Beyond academics, I have actively participated in extracurricular activities that strengthen both my leadership skills and commitment to service. As the President of the Student Council, I have had the privilege of representing my peers and collaborating with faculty to improve our academic environment. Additionally, I co-founded the Campus Startup Initiative, creating a platform for innovative students to share and develop their entrepreneurial ideas. I have also coordinated the Youth Empowerment Program and organized charity events for the Red Cross, solidifying my dedication to both leadership and community service. In applying for this scholarship, I aim to secure the resources necessary to enrich my educational experience and further my career aspirations. With a keen interest in computer engineering and the role technology plays in our rapidly evolving society, I intend to leverage the knowledge and skills gained during my studies to innovate within the tech industry. This scholarship will be instrumental in providing the support I need to conduct research in cutting-edge technologies and pursue higher learning that directly aligns with my long-term goals. I currently receive financial support from another scholarship; however, with an annual family income of $38,761, additional funding will significantly alleviate my financial burden and enable me to focus entirely on my academic and professional endeavors. I am grateful for your consideration of my scholarship application. I believe that with your support, I can continue to excel academically and make meaningful contributions to my community and field of study. My academic reference, Victoria Weeks, can further attest to my commitment and capabilities, and she can be reached at newmanallison@hoffman-french.com for any additional insights. Thank you for considering my application. I look forward to the possibility of contributing to and growing within the academic community supported by your esteemed scholarship.",
            "reference1": "",
            "reference1Email": "",
            "submission_time": "2025-11-04 15:11:04"
        }
    },
    {
        "task": 3,
        "model": "qwen3-vl-flash",
        "dur": 93.71298789978027,
        "step": 19,
        "result": {
            "firstName": "Alexa",
            "middleName": "Michelle",
            "lastName": "Lawrence",
            "studentId": 96009974,
            "gpa": 3.47,
            "major": "Economics",
            "academicYear": "senior",
            "financialAid": "Other Scholarships",
            "familyIncome": 72451,
            "achievements": [
                "Won the State Physics Olympiad",
                " ranked in the Top 5% of the International Chemistry Olympiad",
                " secured first place in the University Math Competition",
                " and received the Dean's List Award for Outstanding Academic Performance."
            ],
            "extracurricular": [
                "Served as President of the Student Council",
                " volunteered at the local community center",
                " co-founded the Campus Startup Initiative",
                " and organized charity events for the Red Cross."
            ],
            "essay": "Dear Scholarship Committee,\r\n\r\nMy name is Alexa Michelle Lawrence, and I am currently a Senior majoring in Economics at your esteemed institution. I am applying for the scholarship opportunity to support my educational journey.\r\n\r\nAs a first-generation college student, financial assistance plays a vital role in enabling me to continue my education and pursue my passion for Economics. My current GPA stands at 3.47, and I have a track record of academic achievements, including winning the State Physics Olympiad, ranking in the Top 5% of the International Chemistry Olympiad, securing first place in the University Math Competition, and receiving the Dean's List Award for Outstanding Academic Performance. These accolades highlight my dedication to academic excellence and my commitment to continuous learning and growth.\r\n\r\nIn addition to my academic pursuits, I am actively involved in extracurricular activities that have allowed me to develop leadership skills and give back to the community. I serve as the President of the Student Council, volunteer at the local community center, co-founded the Campus Startup Initiative, and organized charity events for the Red Cross. These experiences have shaped me into a well-rounded individual who is passionate about making a positive impact in society.\r\n\r\nWith an annual family income of $72,451 and currently receiving another scholarship, this additional financial support would alleviate the burden of tuition fees and living expenses, allowing me to fully focus on my studies and community service efforts. I aspire to become a leader in public health, and this scholarship would be instrumental in helping me achieve my career goals.\r\n\r\nI have listed Mr. Dustin Ward, my academic reference, who can provide further insight into my academic abilities and character. He can be reached at shelly24@gmail.com for any reference verification.\r\n\r\nI am grateful for the opportunity to be considered for this scholarship and am eager to continue my educational journey while contributing meaningfully to society. Thank you for your time and consideration.\r\n\r\nSincerely,\r\nAlexa Michelle Lawrence\r\nStudent ID: 96009974",
            "reference1": "",
            "reference1Email": "",
            "submission_time": "2025-11-04 15:12:51"
        }
    },
    {
        "task": 4,
        "model": "qwen3-vl-flash",
        "dur": 96.20582175254822,
        "step": 19,
        "result": {
            "firstName": "Alan",
            "middleName": "Steve",
            "lastName": "Padilla",
            "studentId": 46822305,
            "gpa": 3.85,
            "major": "Economics",
            "academicYear": "senior",
            "financialAid": "Student Loans",
            "familyIncome": 81640,
            "achievements": [
                "Finalist in the National Robotics Championship",
                " First place in the University Math Competition",
                " Published research paper in the International Journal of Engineering",
                " Winner of the State Physics Olympiad"
            ],
            "extracurricular": [
                "Co-founded the Campus Startup Initiative to encourage entrepreneurial spirit among students",
                " Active member of the Environmental Awareness Club promoting sustainability and environmental responsibility"
            ],
            "essay": "My name is Alan Steve Padilla, and I am a senior pursuing a degree in Economics at [Your University]. With a current GPA of 3.85, I am committed to academic excellence and am eager to broaden my understanding of concepts that are vital for our society today. My student ID is 46822305, and I am writing to humbly apply for the [Name of Scholarship]. In addition to my academic pursuits, I have engaged deeply with my field and my community by participating in various organizations and competitions. I am proud to have been a finalist in the National Robotics Championship and to hold first place in the University Math Competition. I have also published a research paper in the International Journal of Engineering and emerged as the winner of the State Physics Olympiad. These achievements are a testament to my dedication to scholarship and innovative thinking. Outside the classroom, I co-founded the Campus Startup Initiative, a platform encouraging entrepreneurial spirit among fellow students, and I am an active member of the Environmental Awareness Club. My involvement in these groups has allowed me to work collaboratively on projects aimed at promoting sustainability and environmental responsibility\u2014topics I am deeply passionate about. The importance of financial support resonates with my current situation. My family has an annual income of $81,640, and while I have managed to finance my education through student loans, the financial burden can be daunting. Receiving this scholarship would alleviate much of that pressure, enabling me to focus my energies on my studies and extracurricular pursuits without the constant worry of financial constraints. My goal is clear: I aspire to leverage my knowledge in economics to contribute meaningfully to sustainable development initiatives. This scholarship will empower me to continue my studies with fewer financial worries and allow me to delve deeper into learning how economic frameworks can be adapted to bolster environmental sustainability. I respectfully request your consideration of my application for this scholarship. It would be an honor to be selected, and I assure you that the investment in my education will not go unappreciated. For any academic references, I kindly list Gina Guerra, who can be reached at owatkins@smith-davis.info. Thank you very much for your time and consideration. I appreciate the opportunity to share my journey, and I look forward to the possibility of contributing positively to our world in the future.",
            "reference1": "",
            "reference1Email": "",
            "submission_time": "2025-11-04 15:14:33"
        }
    },
    {
        "task": 5,
        "model": "qwen3-vl-flash",
        "dur": 59.68046188354492,
        "step": 10,
        "result": {
            "firstName": "Mark",
            "middleName": "Rachael",
            "lastName": "Holloway",
            "studentId": 8707836,
            "gpa": 3.65,
            "major": "Law",
            "academicYear": "freshman",
            "financialAid": "Grants",
            "familyIncome": "$46,943",
            "achievements": [
                "Published a research paper in the International Journal of Engineering and won the State Physics Olympiad",
                " Finalist in the National Robotics Championship"
            ],
            "extracurricular": [
                "Co-founded the Campus Startup Initiative to encourage entrepreneurial spirit among students",
                " Volunteered at the local community center to give back to the community",
                " Coordinated the Youth Empowerment Program to foster leadership skills in young individuals"
            ],
            "essay": "Dear Scholarship Committee,\r\n\r\nI hope this letter finds you well. My name is Mark Rachael Holloway, a freshman majoring in Law at [University Name], with a Student ID of 8707836. I am writing to express my earnest intention to apply for the [Scholarship Name] Scholarship. With a GPA of 3.65, I have a strong academic foundation which I intend to build upon as I navigate my studies and prepare for a career that can positively impact society.\r\n\r\nThroughout my academic journey, I have been motivated by the belief that law should be a tool for social change. This belief has driven my passion and commitment to excel in my studies. I am proud to have published a research paper in the International Journal of Engineering and to have been a finalist in the National Robotics Championship, as well as winning the State Physics Olympiad. These achievements showcase not only my dedication to learning but also my ability to apply my knowledge in practical settings.\r\n\r\nMy financial situation, meanwhile, presents certain challenges. My family\u2019s annual income is $46,943, and I currently receive grants to support my education. Despite this financial support, the burdens of tuition fees and related costs remain daunting. This scholarship would alleviate some of that financial pressure and allow me to dedicate more of my energy toward my academic pursuits.\r\n\r\nBeyond academics, I am actively involved in several extracurricular activities. I co-founded the Campus Startup Initiative, creating a platform that encourages entrepreneurial spirit and innovation among students. Furthermore, I volunteer at the local community center, hoping to give back to my community, and I coordinate a Youth Empowerment Program aimed at fostering leadership skills in young individuals. These experiences have taught me the importance of service and leadership, skills that I believe are essential in my field of study.\r\n\r\nAs I aspire to advance my knowledge in law and eventually impact sustainable development, the opportunity presented by this scholarship would significantly enhance my educational experience. I am deeply passionate about being part of the solution to today\u2019s most pressing environmental challenges, and the financial support would allow me to focus more intently on my studies.\r\n\r\nI would like to express my gratitude for considering my application. If needed, I can provide an academic reference from Kelly Mendoza, who can be reached at lauren99@clark.com. I wholeheartedly believe that with the support of the [Scholarship Name] Scholarship, I will be better equipped to achieve my aspirations.\r\n\r\nThank you for your time and consideration. I look forward to the possibility of contributing to and growing within the [University Name] community.\r\n\r\nSincerely,\r\n\r\nMark Rachael Holloway\r\nStudent ID: 8707836\r\nMajor: Law\r\nCurrent GPA: 3.65\r\n[Your Contact Information]\r\n[Your Phone Number]",
            "reference1": "",
            "reference1Email": "",
            "submission_time": "2025-11-04 15:15:34"
        }
    },
    {
        "task": 6,
        "model": "qwen3-vl-flash",
        "dur": 96.70323395729065,
        "step": 19,
        "result": {
            "firstName": "James",
            "middleName": "Aaron",
            "lastName": "Brewer",
            "studentId": 23880848,
            "gpa": 3.14,
            "major": "Philosophy",
            "academicYear": "junior",
            "financialAid": "Student Loans",
            "familyIncome": 62058,
            "achievements": [
                "I placed in the top 5% in the International Chemistry Olympiad and received the Dean\u2019s List Award for Outstanding Academic Performance. In addition",
                " I published a research paper in the International Journal of Engineering and emerged as the winner of the State Physics Olympiad."
            ],
            "extracurricular": [
                "As the Coordinator of the Youth Empowerment Program",
                " I have led initiatives fostering skills and opportunities for younger individuals in our community. Volunteering at the local community center has allowed me to connect with diverse populations and gain insights into social issues. Additionally",
                " organizing charity events for the Red Cross reflects my commitment to making a positive societal impact."
            ],
            "essay": "",
            "reference1": "",
            "reference1Email": "",
            "submission_time": "2025-11-04 15:17:21"
        }
    },
    {
        "task": 7,
        "model": "qwen3-vl-flash",
        "dur": 105.2427110671997,
        "step": 20,
        "result": {
            "firstName": "Alexis",
            "middleName": "Valerie",
            "lastName": "Townsend",
            "studentId": 88351132,
            "gpa": 3.73,
            "major": "Mechanical Engineering",
            "academicYear": "sophomore",
            "financialAid": "Other Scholarships",
            "familyIncome": 95479,
            "achievements": [
                "Published a research paper in the International Journal of Engineering",
                " Dean's List inclusion",
                " First place in University Math Competition",
                " Winner of the National Science Fair"
            ],
            "extracurricular": [
                "Organized charity events for the Red Cross",
                " Member of the University Debate Team"
            ],
            "essay": "I am deeply passionate about advancing my knowledge in the field of environmental science. This scholarship will enable me to continue my studies without the pressure of financial burdens, and I plan to use the knowledge gained to make an impact in sustainable development. This scholarship would alleviate financial stress, allowing me to focus wholeheartedly on my education and engage in additional research opportunities. I believe that education is a powerful catalyst for change, and with your support, I can continue my efforts toward becoming an engineer who prioritizes environmental sustainability. My annual family income of $95,479 helps provide a stable foundation, yet the financial assistance offered by this scholarship would be instrumental in allowing me to pursue higher educational ventures.",
            "reference1": "",
            "reference1Email": "",
            "submission_time": "2025-11-04 15:19:13"
        }
    },
    {
        "task": 8,
        "model": "qwen3-vl-flash",
        "dur": 104.67015099525452,
        "step": 21,
        "result": {
            "firstName": "Jennifer",
            "middleName": "Travis",
            "lastName": "Dyer",
            "studentId": 71094769,
            "gpa": 2.61,
            "major": "English Literature",
            "academicYear": "senior",
            "financialAid": "None",
            "familyIncome": 90530,
            "achievements": [
                "First place in the University Math Competition",
                " winner of the National Science Fair",
                " published research paper in the International Journal of Engineering"
            ],
            "extracurricular": [
                "Member of the University Debate Team",
                " Coordinator of the Youth Empowerment Program"
            ],
            "essay": "Dear Scholarship Committee,\r\n\r\nMy name is Jennifer Travis Dyer, and I am a Senior majoring in English Literature at the university. I am writing to express my sincere interest in applying for the scholarship opportunity to further support my academic pursuits.\r\n\r\nAs a dedicated student with a current GPA of 2.61, I have strived to excel in my academic endeavors while actively participating in extracurricular activities. Despite not receiving any current financial aid, I have managed to achieve significant academic accomplishments. I have been honored with first place in the University Math Competition, won the National Science Fair, and even had the privilege of publishing a research paper in the prestigious International Journal of Engineering.\r\n\r\nIn addition to my academic achievements, I am actively involved in extracurricular activities on campus. I am a proud member of the University Debate Team and serve as the Coordinator of the Youth Empowerment Program. These experiences have further honed my leadership and communication skills while allowing me to give back to my community.\r\n\r\nReceiving this scholarship would alleviate the financial burden on my family, as our annual income stands at $90,530. This support would enable me to focus on my studies and successfully complete my degree without the stress of financial constraints. With a passion for data science, I aspire to contribute towards solving global challenges in this field. This scholarship would provide me with the necessary resources to pursue a career in data science and make a positive impact on society.\r\n\r\nI have included Monica Norton as my academic reference, whose contact email is qlove@taylor.net. She can attest to my dedication, academic abilities, and potential to succeed in my chosen field. I am confident that with your support, I can achieve my academic and career goals.\r\n\r\nThank you for considering my application. I look forward to the opportunity to contribute to the scholarship program and make the most of this valuable support.\r\n\r\nSincerely,\r\n\r\nJennifer Travis Dyer\r\nStudent ID: 71094769\r\nMajor/Field of Study: English Literature\r\nAcademic Year: Senior\r\nEmail: jennifer.dyer@email.com",
            "reference1": "",
            "reference1Email": "",
            "submission_time": "2025-11-04 15:21:04"
        }
    },
    {
        "task": 9,
        "model": "qwen3-vl-flash",
        "dur": 99.07816195487976,
        "step": 18,
        "result": {
            "firstName": "Julie",
            "middleName": "Taylor",
            "lastName": "Powell",
            "studentId": 69668325,
            "gpa": 3.07,
            "major": "Mathematics",
            "academicYear": "freshman",
            "financialAid": "Student Loans",
            "familyIncome": 87788,
            "achievements": [
                "Received the Dean's List Award for Outstanding Academic Performance and ranked in the top 5% in the International Chemistry Olympiad",
                " Winner of the National Science Fair and finalist in the National Robotics Championship"
            ],
            "extracurricular": [
                "I serve as the Coordinator of the Youth Empowerment Program",
                " where I devise initiatives aimed at fostering growth and leadership skills among our youth. My commitment to service extends to organizing charity events for the Red Cross",
                " aimed at support for those in need",
                " and volunteering at our local community center. These experiences have reinforced my belief in the importance of giving back to the community and instilled in me a sense of responsibility towards social causes."
            ],
            "essay": "I am deeply passionate about advancing my knowledge in the field of Mathematics. While my primary interest lies in solving complex problems through a mathematical lens, I believe in applying this knowledge to real-world environmental challenges. This scholarship would alleviate the financial burdens that accompany my education, allowing me to focus more intently on my studies without the looming stress of financial constraints. My aspiration is to utilize the knowledge gained through my studies to make meaningful contributions to sustainable development efforts, creating solutions that positively impact our world.",
            "reference1": "",
            "reference1Email": "",
            "submission_time": "2025-11-04 15:22:50"
        }
    },
    {
        "task": 10,
        "model": "qwen3-vl-flash",
        "dur": 103.9278347492218,
        "step": 19,
        "result": {
            "firstName": "Melissa",
            "middleName": "Joshua",
            "lastName": "Leblanc",
            "studentId": 1073052,
            "gpa": 3.15,
            "major": "Environmental Science",
            "academicYear": "sophomore",
            "financialAid": "None",
            "familyIncome": 20557,
            "achievements": [
                "Finalist in the National Robotics Championship",
                " placed in the top 5% of the International Chemistry Olympiad",
                " won the National Science Fair."
            ],
            "extracurricular": [
                "Volunteer at the local community center",
                " member of the University Debate Team",
                " organize charity events for the Red Cross",
                " President of the Student Council"
            ],
            "essay": "Dear Scholarship Committee,\r\n\r\nI am writing to express my sincere interest in the scholarship opportunity available to students pursuing higher education in the field of Environmental Science. My name is Melissa Joshua Leblanc, and I am currently a sophomore majoring in Environmental Science with a current GPA of 3.15.\r\n\r\nAs a dedicated and motivated student, I have strived for excellence in my academic pursuits. I am proud to have been a finalist in the National Robotics Championship, placed in the top 5% of the International Chemistry Olympiad, and won the National Science Fair. These achievements reflect my passion for science and my commitment to academic excellence.\r\n\r\nIn addition to my academic achievements, I am actively involved in extracurricular activities that have helped me develop leadership and teamwork skills. I volunteer at the local community center, am a member of the University Debate Team, organize charity events for the Red Cross, and currently serve as the President of the Student Council. These activities have allowed me to make a positive impact in my community and hone important skills that will be valuable as I continue my studies in Environmental Science.\r\n\r\nDespite my academic and extracurricular involvement, my family's annual income of $20,557 places a significant financial burden on me as I strive to complete my education. Currently, I do not receive any financial aid which makes it challenging for me to afford tuition and other educational expenses. This scholarship would greatly alleviate this financial pressure and allow me to focus on my studies and research projects.\r\n\r\nMy long-term goal is to innovate in the tech industry by combining my interest in computer engineering with my passion for environmental science. This scholarship would provide me with the resources to further my education and pursue research opportunities in cutting-edge technologies, bringing me one step closer to achieving my career aspirations.\r\n\r\nI am confident that with my dedication, academic achievements, and extracurricular involvement, I have demonstrated my commitment to pursuing a career in Environmental Science. I am honored to have Melissa Clark as my academic reference, who can attest to my passion for learning and drive to succeed. Please feel free to contact her at madams@hotmail.com for any additional information.\r\n\r\nThank you for considering my application. I am looking forward to the opportunity to further my education and make a positive impact in the field of Environmental Science with your support.\r\n\r\nSincerely,\r\nMelissa Joshua Leblanc\r\nStudent ID: 1073052",
            "reference1": "",
            "reference1Email": "",
            "submission_time": "2025-11-04 16:14:27"
        }
    },
    {
        "task": 11,
        "model": "qwen3-vl-flash",
        "dur": 118.77974486351013,
        "step": 19,
        "result": {
            "firstName": "Rachel",
            "middleName": "Elizabeth",
            "lastName": "Moore",
            "studentId": 59711198,
            "gpa": 3.62,
            "major": "Environmental Science",
            "academicYear": "sophomore",
            "financialAid": "Grants",
            "familyIncome": "$69,379",
            "achievements": [
                "Placed first in the University Math Competition and won the State Physics Olympiad"
            ],
            "extracurricular": [
                "Volunteering at the local community center",
                " organizing charity events for the Red Cross",
                " co-founding the Campus Startup Initiative",
                " and being a member of the University Debate Team."
            ],
            "essay": "Dear Scholarship Committee,\r\n\r\nMy name is Rachel Elizabeth Moore, and I am currently a sophomore majoring in Environmental Science. I am writing to apply for the scholarship opportunity in order to continue my education and pursue my passion for making a difference in public health.\r\n\r\nAs a first-generation college student, financial assistance is vital for me to achieve my academic goals and make a positive impact on society. With a current GPA of 3.62, I have strived for excellence in my studies while actively participating in various extracurricular activities and community service projects.\r\n\r\nI have been fortunate to receive grants for my financial aid, however, additional assistance will greatly alleviate the financial burden on my family. Our annual income of $69,379 places us in a position where every dollar counts towards my education.\r\n\r\nMy academic achievements, including placing first in the University Math Competition and winning the State Physics Olympiad, demonstrate my dedication to excellence. Furthermore, my involvement in extracurricular activities such as volunteering at the local community center, organizing charity events for the Red Cross, co-founding the Campus Startup Initiative, and being a member of the University Debate Team, showcases my commitment to both personal growth and community engagement.\r\n\r\nThe scholarship will not only support my academic endeavors but will also allow me to expand my horizons and opportunities in the field of Environmental Science. My long-term goal is to become a leader in public health, and this financial aid will enable me to focus on my studies and contribute meaningfully to my community.\r\n\r\nI am grateful for the opportunity to be considered for this scholarship, and I believe that with your support, I can continue to excel academically and make a positive impact on those around me. I have included my academic reference, Misty Turner, whose email is mark87@hotmail.com, for further validation of my academic achievements and character.\r\n\r\nThank you for considering my application. I look forward to the possibility of being awarded this scholarship and continuing on my path towards academic and professional growth.\r\n\r\nSincerely,\r\nRachel Elizabeth Moore\r\nStudent ID: 59711198\r\nAcademic Reference: Misty Turner",
            "reference1": "",
            "reference1Email": "",
            "submission_time": "2025-11-04 16:16:32"
        }
    },
    {
        "task": 12,
        "model": "qwen3-vl-flash",
        "dur": 91.0928430557251,
        "step": 19,
        "result": {
            "firstName": "Sara",
            "middleName": "Sarah",
            "lastName": "Aguirre",
            "studentId": 27811507,
            "gpa": 3.77,
            "major": "Business Administration",
            "academicYear": "freshman",
            "financialAid": "Grants",
            "familyIncome": 47631,
            "achievements": [
                "I have received the Dean\u2019s List Award for Outstanding Academic Performance. Additionally",
                " I have published a research paper in the International Journal of Engineering and secured first place in the University Math Competition."
            ],
            "extracurricular": [
                "As a member of the University Debate Team",
                " I have honed my critical thinking and public speaking skills. Additionally",
                " I organized charity events for the Red Cross",
                " demonstrating my commitment to community service and making a positive impact."
            ],
            "essay": "I am writing to apply for the scholarship opportunity that could greatly assist me in my academic journey at [University Name]. My name is Sara Sarah Aguirre, and I am currently a freshman majoring in Business Administration with a cumulative GPA of 3.77. As a dedicated student and an active member of the university community, I believe I would be a deserving recipient of your support. Throughout my academic career thus far, I have strived for excellence and am proud to share that I have received the Dean\u2019s List Award for Outstanding Academic Performance. Additionally, I have published a research paper in the International Journal of Engineering, which reflects my commitment to scholarly contributions. I also secured first place in the University Math Competition, demonstrating my ability to excel in challenging environments. Beyond my academic endeavors, I am actively involved in extracurricular activities that foster both personal and professional growth. As a member of the University Debate Team, I have honed my critical thinking and public speaking skills, which are essential for a future in business administration. Furthermore, I have organized charity events for the Red Cross, exemplifying my belief in giving back to the community and making a positive impact on those in need. While I am fortunate to currently receive financial aid through another scholarship, my annual family income of $47,631 presents certain challenges that could impact my study journey. The financial support from this scholarship would alleviate the pressure of monetary concerns, allowing me to immerse myself completely in my studies and extracurricular commitments. My passion lies not just in advancing my own education but also in utilizing the knowledge I will gain in business administration to contribute to sustainable development. I am eager to engage in projects and discussions that weave environmental consciousness into business practices, thus paving the way for a sustainable future. For your consideration, I have provided my academic reference, Sophia Hale, who can speak to my character and accomplishments. You may reach her via email at elizabeth44@hotmail.com. Thank you for considering my application. I am excited about the prospect of receiving this scholarship, which will play a vital role in my journey. I look forward to the opportunity to contribute positively to our society through my studies and future career in business.",
            "reference1": "",
            "reference1Email": "",
            "submission_time": "2025-11-04 16:18:10"
        }
    },
    {
        "task": 13,
        "model": "qwen3-vl-flash",
        "dur": 79.16781425476074,
        "step": 17,
        "result": {
            "firstName": "Erica",
            "middleName": "Danielle",
            "lastName": "Cannon",
            "studentId": 40406788,
            "gpa": 2.91,
            "major": "Biology",
            "academicYear": "freshman",
            "financialAid": "",
            "familyIncome": 76424,
            "achievements": [],
            "extracurricular": [],
            "essay": "",
            "reference1": "",
            "reference1Email": "",
            "submission_time": "2025-11-04 16:19:35"
        }
    },
    {
        "task": 14,
        "model": "qwen3-vl-flash",
        "dur": 120.56275725364685,
        "step": 20,
        "result": {
            "firstName": "Megan",
            "middleName": "Juan",
            "lastName": "Nguyen",
            "studentId": 51063098,
            "gpa": 3.87,
            "major": "Business Administration",
            "academicYear": "junior",
            "financialAid": "None",
            "familyIncome": 76896,
            "achievements": [
                "Winner of the National Science Fair",
                " Dean\u2019s List Award for Outstanding Academic Performance",
                " published a research paper in the International Journal of Engineering",
                " finalist in the National Robotics Championship"
            ],
            "extracurricular": [
                "Member of the Environmental Awareness Club",
                " President of the Student Council",
                " organized charity events for the Red Cross"
            ],
            "essay": "Dear Scholarship Committee,\r\n\r\nMy name is Megan Juan Nguyen, and I am currently a Junior majoring in Business Administration at the University. I am writing to apply for the scholarship opportunity to alleviate the financial burden of my education and allow me to focus on excelling in my studies.\r\n\r\nWith a current GPA of 3.87, I have been dedicated to my academic career and have received recognition for my achievements. I have been honored to be the winner of the National Science Fair, received the Dean\u2019s List Award for Outstanding Academic Performance, published a research paper in the International Journal of Engineering, and was a finalist in the National Robotics Championship. These experiences have not only enriched my knowledge but have also instilled in me the drive to excel in my field.\r\n\r\nIn addition to my academic pursuits, I am actively involved in extracurricular activities that enhance my leadership and community engagement skills. I am a member of the Environmental Awareness Club, serve as the President of the Student Council, and have organized charity events for the Red Cross. These experiences have further shaped me into a well-rounded individual with a passion for making a positive impact on society.\r\n\r\nHowever, financial constraints have posed a challenge to fully focus on my studies and career aspirations. My family's annual income of $76,896 leaves little room for excess expenses, and I currently do not receive any financial aid. Thus, this scholarship would immensely help me alleviate the financial burden and allow me to fully dedicate myself to completing my degree and pursuing a career in data science.\r\n\r\nMy ultimate goal is to contribute to solving global challenges through my expertise in data science. With the help of this scholarship, I can pursue this career path with unwavering focus and determination, knowing that financial constraints will not hinder my progress.\r\n\r\nI believe that my academic achievements, extracurricular involvement, and dedication to my career goals make me a strong candidate for this scholarship. I am confident that with your support, I will continue to excel academically and make a positive impact in the field of Business Administration.\r\n\r\nI have included a reference from Jamie Grant, who can attest to my dedication and commitment to my studies. If you require any further information or documentation, please do not hesitate to contact me or my academic reference at longanna@walker-thomas.com.\r\n\r\nThank you for considering my application. I am eager to contribute to the future of our society and look forward to the opportunity this scholarship will provide.\r\n\r\nSincerely,\r\nMegan Juan Nguyen\r\nStudent ID: 51063098",
            "reference1": "",
            "reference1Email": "",
            "submission_time": "2025-11-04 16:21:43"
        }
    },
    {
        "task": 15,
        "model": "qwen3-vl-flash",
        "dur": 101.91213893890381,
        "step": 20,
        "result": {
            "firstName": "Patrick",
            "middleName": "Matthew",
            "lastName": "Smith",
            "studentId": 90577005,
            "gpa": 2.66,
            "major": "Biology",
            "academicYear": "sophomore",
            "financialAid": "None",
            "familyIncome": 42061,
            "achievements": [
                "Won the State Physics Olympiad",
                " published a research paper in the International Journal of Engineering",
                " received the Dean\u2019s List Award for Outstanding Academic Performance",
                " and was a finalist in the National Robotics Championship."
            ],
            "extracurricular": [
                "President of the Student Council and Coordinator of the Youth Empowerment Program",
                " Volunteered at the local community center and was a member of the University Debate Team"
            ],
            "essay": "I am writing to apply for your esteemed scholarship, which I believe will significantly assist me in pursuing my academic and career goals in the field of Biology. My name is Patrick Matthew Smith, a sophomore at [Your University], where I am currently focused on advancing my knowledge in Biology. As a dedicated student with a student ID of 90577005, I aim to contribute positively to both my academic community and the broader field of environmental science.\r\n\r\nDespite my commitment to my studies, my current GPA of 2.66 does not reflect the hard work and passion I have for my field and the challenges that have come my way. My family's annual income of $42,061 limits my access to financial aid, which puts a considerable strain on my ability to continue my education without the pressure of financial burdens. I have not received any financial aid yet, which compounds my struggles, making this scholarship all the more crucial.\r\n\r\nI am proud to highlight several academic achievements that underscore my dedication to excellence. Among these, I won the State Physics Olympiad and published a research paper in the International Journal of Engineering. Furthermore, I received the Dean\u2019s List Award for Outstanding Academic Performance and was a finalist in the National Robotics Championship. These achievements not only reflect my academic abilities but also my determination to excel in science and technology.\r\n\r\nIn addition to my academic pursuits, I have engaged in various extracurricular activities that showcase my leadership skills and commitment to community service. As the President of the Student Council and the Coordinator of the Youth Empowerment Program, I have developed essential skills in leadership and organizational management. Volunteering at the local community center has taught me the significance of giving back, while being a member of the University Debate Team has honed my critical thinking and communication skills.\r\n\r\nI am deeply passionate about advancing my knowledge in environmental science. My ultimate goal is to leverage the education I receive to impact sustainable development positively. Receiving this scholarship would alleviate financial burdens and enable me to focus entirely on my studies and extracurricular involvements, enhancing both my academic and personal growth.\r\n\r\nI respectfully ask you to consider my application for this scholarship. My academic reference, Zachary Schultz, is available for any inquiries regarding my achievements and character. He can be reached at michaelrobertson@yahoo.com. I am hopeful that with your support, I will be able to continue my educational journey and make meaningful contributions to our society through science and leadership.\r\n\r\nThank you for considering my application. I look forward to the potential opportunity to carry out my aspirations with your generous assistance.",
            "reference1": "",
            "reference1Email": "",
            "submission_time": "2025-11-04 16:23:31"
        }
    },
    {
        "task": 16,
        "model": "qwen3-vl-flash",
        "dur": 94.01251888275146,
        "step": 18,
        "result": {
            "firstName": "Tara",
            "middleName": "Anthony",
            "lastName": "Taylor",
            "studentId": 77160892,
            "gpa": 3.99,
            "major": "Mathematics",
            "academicYear": "freshman",
            "financialAid": "Student Loans",
            "familyIncome": 51259,
            "achievements": [
                "Winner of the State Physics Olympiad",
                " first place in the University Math Competition",
                " published a research paper in the International Journal of Engineering",
                " ranked in the top 5% in the International Chemistry Olympiad."
            ],
            "extracurricular": [
                "Volunteer at the local community center",
                " member of the Environmental Awareness Club",
                " participant in the University Debate Team"
            ],
            "essay": "Dear Scholarship Committee,\r\n\r\nMy name is Tara Anthony Taylor, and I am a dedicated freshman student majoring in Mathematics. I am excited to apply for the scholarship opportunity to further support my academic journey and professional aspirations.\r\n\r\nAs a student with a current GPA of 3.99, I have consistently strived for academic excellence. My academic achievements include being the winner of the State Physics Olympiad, securing first place in the University Math Competition, publishing a research paper in the International Journal of Engineering, and ranking in the top 5% in the International Chemistry Olympiad. These accomplishments are a testament to my passion for learning and my commitment to success in my field of study.\r\n\r\nIn addition to my academic pursuits, I am actively involved in extracurricular activities that contribute to both my personal growth and community service. I volunteer at the local community center, am a member of the Environmental Awareness Club, and participate in the University Debate Team. These experiences have shaped me into a well-rounded individual who values giving back to society and engaging in meaningful causes.\r\n\r\nFinancially, my family income is $51,259, and I currently rely on student loans to fund my education. This scholarship will alleviate the financial burden on my family and allow me to focus wholeheartedly on my studies. It will provide me with the opportunity to fully immerse myself in my coursework and research projects, ultimately leading me closer to my goal of pursuing a career in data science. In this field, I aim to utilize my mathematical skills to contribute to solving global challenges and making a positive impact on society.\r\n\r\nI have submitted Teresa Hudson as my academic reference, whose contact information is kimberly60@hernandez.com, for your further assessment of my academic and personal qualities.\r\n\r\nI am confident that receiving this scholarship will enable me to reach my fullest potential and achieve my academic and professional goals. I am grateful for your time and consideration of my application.\r\n\r\nSincerely,\r\n\r\nTara Anthony Taylor\r\n(Student ID: 77160892)",
            "reference1": "",
            "reference1Email": "",
            "submission_time": "2025-11-04 16:25:12"
        }
    },
    {
        "task": 17,
        "model": "qwen3-vl-flash",
        "dur": 86.70803093910217,
        "step": 17,
        "result": {
            "firstName": "Heather",
            "middleName": "Miguel",
            "lastName": "Carter",
            "studentId": 4813002,
            "gpa": 2.66,
            "major": "Engineering",
            "academicYear": "freshman",
            "financialAid": "Student Loans",
            "familyIncome": 50798,
            "achievements": [
                "I am a freshman majoring in Engineering with a current GPA of 2",
                "66 at this esteemed institution",
                " I have been recognized as a finalist in the National Robotics Championship and received the Dean\u2019s List Award for Outstanding Academic Performance"
            ],
            "extracurricular": [
                "Organizing charity events for the Red Cross and being a member of the Environmental Awareness Club"
            ],
            "essay": "I am applying for this scholarship to assist in financing my education and pursue my passion for computer engineering. Despite facing financial challenges, I have managed to excel academically, being recognized as a finalist in the National Robotics Championship and receiving the Dean\u2019s List Award for Outstanding Academic Performance. These achievements are a testament to my dedication and hard work towards my academic endeavors. In addition to my academic achievements, I am actively involved in extracurricular activities, such as organizing charity events for the Red Cross and being a member of the Environmental Awareness Club. These experiences have not only broadened my perspective but also instilled in me the values of leadership, teamwork, and social responsibility. I come from a family with an annual income of $50,798 and currently rely on student loans for financial aid. This scholarship would alleviate the financial burden on my family and allow me to focus more on my studies and extracurricular activities. With this support, I aim to conduct research in cutting-edge technologies, contributing to innovation in the tech industry. I have attached a statement of purpose outlining my aspirations and how this scholarship will enable me to achieve my long-term career goals. Moreover, my academic reference, Kaylee Ashley, can attest to my academic capabilities and dedication to my field of study. I am truly grateful for your consideration of my application and the opportunity to further my education through your generous support.",
            "reference1": "",
            "reference1Email": "",
            "submission_time": "2025-11-04 16:26:39"
        }
    },
    {
        "task": 18,
        "model": "qwen3-vl-flash",
        "dur": 87.62777280807495,
        "step": 16,
        "result": {
            "firstName": "Mary",
            "middleName": "Thomas",
            "lastName": "Miles",
            "studentId": 54227455,
            "gpa": 2.69,
            "major": "Political Science",
            "academicYear": "sophomore",
            "financialAid": "Other Scholarships",
            "familyIncome": 95400,
            "achievements": [],
            "extracurricular": [],
            "essay": "",
            "reference1": "",
            "reference1Email": "",
            "submission_time": "2025-11-04 16:28:18"
        }
    },
    {
        "task": 19,
        "model": "qwen3-vl-flash",
        "dur": 99.24309825897217,
        "step": 21,
        "result": {
            "firstName": "David",
            "middleName": "Clifford",
            "lastName": "Rodriguez",
            "studentId": 13474807,
            "gpa": 3.62,
            "major": "Environmental Science",
            "academicYear": "sophomore",
            "financialAid": "Student Loans",
            "familyIncome": "$99,640",
            "achievements": [
                "Published a research paper in the International Journal of Engineering",
                " won the State Physics Olympiad",
                " and was a finalist in the National Robotics Championship."
            ],
            "extracurricular": [
                "I am an active member of the Environmental Awareness Club and a co-founder of the Campus Startup Initiative. These roles have allowed me to lead projects",
                " collaborate with peers",
                " and organize community events focused on sustainability and innovation."
            ],
            "essay": "My name is David Clifford Rodriguez, and I am a sophomore majoring in Environmental Science with a current GPA of 3.62. As a first-generation college student, I am excited to apply for the scholarship opportunity to further my academic journey and make a significant impact on my community and the field of public health. I come from a modest background with an annual family income of $99,640. Currently, my education is supported through student loans, and receiving this scholarship would alleviate the financial burden, allowing me to focus entirely on my studies and involvement in extracurricular activities. I am proud to share my academic achievements, which include publishing a research paper in the International Journal of Engineering, winning the State Physics Olympiad, and being a finalist in the National Robotics Championship. These accomplishments exemplify my dedication to academic excellence and my passion for learning. In addition to my academic pursuits, I am an active member of the Environmental Awareness Club and a co-founder of the Campus Startup Initiative. These extracurricular activities have allowed me to engage with my peers, contribute to environmental causes, and develop valuable leadership skills that I hope to utilize in my future career in public health. My ultimate goal is to become a leader in public health, combining my passion for environmental science with community service to make a positive impact on society. With the support of this scholarship, I will be able to achieve this dream and continue to strive for excellence in both my academic and personal endeavors. I am grateful for the opportunity to apply for this scholarship and appreciate your consideration of my application. I have included Mary Ferguson as my academic reference, and she can be reached at tammy98@campbell.net for any further information regarding my academic performance and character.",
            "reference1": "",
            "reference1Email": "",
            "submission_time": "2025-11-04 16:30:03"
        }
    },
    {
        "task": 20,
        "model": "qwen3-vl-flash",
        "dur": 102.5775740146637,
        "step": 16,
        "result": {
            "firstName": "Dillon",
            "middleName": "Ryan",
            "lastName": "Duncan",
            "studentId": 79791724,
            "gpa": 3.93,
            "major": "Business Administration",
            "academicYear": "junior",
            "financialAid": "Grants",
            "familyIncome": 25737,
            "achievements": [
                "Won the National Science Fair",
                " consistently on the Dean's List for Outstanding Academic Performance"
            ],
            "extracurricular": [
                "President of Student Council",
                " Volunteered at local community center",
                " Member of Environmental Awareness Club"
            ],
            "essay": "My name is Dillon Ryan Duncan, a junior student majoring in Business Administration at [University Name]. My Student ID is 79791724, and I am writing to express my heartfelt interest in the [Scholarship Name]. As a dedicated student with a current GPA of 3.93, I am determined to maximize my educational journey while uplifting those around me, and this scholarship is vital to achieving my goals.\r\n\r\nAs a first-generation college student, the challenges of financing my education have been daunting, particularly with an annual family income of $25,737. My current financial aid consists solely of grants, which barely cover my expenses. Receiving this scholarship would not only alleviate my financial burden but also allow me to concentrate fully on my studies and community service initiatives.\r\n\r\nThroughout my academic journey, I have strived for excellence, evident in my achievements such as winning the National Science Fair and consistently being named on the Dean's List for Outstanding Academic Performance. These accomplishments reflect my commitment to learning and my passion for utilizing education as a tool for positive change.\r\n\r\nIn addition to my academic pursuits, I actively engage in extracurricular activities that allow me to serve and lead within my community. As the President of the Student Council, I have developed leadership skills that enable me to advocate for my peers. Volunteering at the local community center has given me the opportunity to directly impact the lives of others, reinforcing my dedication to service. Moreover, as a member of the Environmental Awareness Club, I focus on promoting sustainable practices that benefit both my community and the environment, which aligns with my long-term ambition of becoming a leader in public health.\r\n\r\nMy intent is to leverage my educational experiences and extracurricular involvement to cultivate a career that intersects business acumen with community health initiatives. This scholarship is not merely financial support; it represents an investment in a first-generation student with a passion for learning and a commitment to service.\r\n\r\nShould you require any further information, please feel free to reach out to my academic reference, Francisco Smith, at christopheradams@wilson.org. I sincerely appreciate your consideration of my application and look forward to the possibility of contributing to the legacy of [Scholarship Program Name].\r\n\r\nThank you for your time and support.\r\n\r\nWarm regards,\r\nDillon Ryan Duncan\r\n[Your Contact Information]",
            "reference1": "",
            "reference1Email": "",
            "submission_time": "2025-11-04 16:31:47"
        }
    },
    {
        "task": 21,
        "model": "qwen3-vl-flash",
        "dur": 98.47115111351013,
        "step": 19,
        "result": {
            "firstName": "Julie",
            "middleName": "Lydia",
            "lastName": "Carter",
            "studentId": 993394,
            "gpa": 2.97,
            "major": "Law",
            "academicYear": "senior",
            "financialAid": "None",
            "familyIncome": "",
            "achievements": [
                "First place in the University Math Competition",
                " Winner of the State Physics Olympiad",
                " Dean\u2019s List Award for Outstanding Academic Performance"
            ],
            "extracurricular": [
                "Coordinator of the Youth Empowerment Program",
                " Member of the Environmental Awareness Club",
                " Co-founder of the Campus Startup Initiative"
            ],
            "essay": "Dear Scholarship Committee,\r\n\r\nMy name is Julie Lydia Carter, and I am currently a senior majoring in Law at your esteemed institution. I am writing to express my sincere interest in applying for the scholarship opportunity that you have made available for deserving students. As a first-generation college student, this scholarship holds immense significance for me as it will play a pivotal role in supporting my academic journey and helping me achieve my aspirations.\r\n\r\nMy academic journey has been marked with dedication and perseverance, evident in my current GPA of 2.97. Despite facing financial constraints, I have strived for excellence and have been recognized for my achievements. I have had the honor of securing first place in the University Math Competition, emerging as the winner of the State Physics Olympiad, and receiving the Dean\u2019s List Award for Outstanding Academic Performance. These accomplishments reflect my commitment to academic excellence and my passion for learning.\r\n\r\nIn addition to my academic pursuits, I am actively involved in various extracurricular activities. I serve as the Coordinator of the Youth Empowerment Program, where I have the opportunity to make a positive impact on the lives of young individuals in our community. I am also a member of the Environmental Awareness Club, where I actively participate in initiatives aimed at promoting sustainable practices. Furthermore, I am proud to be a co-founder of the Campus Startup Initiative, where I collaborate with peers to foster innovation and entrepreneurship within our campus community.\r\n\r\nThe scholarship will not only alleviate the financial burden that I currently face but also enable me to focus on my studies and actively engage in community service. My ultimate goal is to become a leader in public health, and this scholarship will bring me closer to realizing that dream. With your support, I will be able to continue my education, contribute to society, and work towards creating a positive impact on the world around me.\r\n\r\nI am grateful for the opportunity to be considered for this scholarship, and I am confident that my academic achievements, extracurricular involvement, and commitment to making a difference set me apart as a deserving candidate. I am fortunate to have Ms. Karina May as my academic reference, and she can attest to my academic capabilities and dedication to my studies.\r\n\r\nThank you for considering my application. I am looking forward to the opportunity to further my education and continue my journey towards becoming a leader in public health.\r\n\r\nSincerely,\r\n\r\nJulie Lydia Carter\r\nStudent ID: 993394\r\nReference Email: craiggordon@long-rogers.com",
            "reference1": "",
            "reference1Email": "",
            "submission_time": "2025-11-04 16:33:36"
        }
    },
    {
        "task": 22,
        "model": "qwen3-vl-flash",
        "dur": 102.0055091381073,
        "step": 14,
        "result": {
            "firstName": "Manuel",
            "middleName": "Christopher",
            "lastName": "Moody",
            "studentId": 45123296,
            "gpa": 3.63,
            "major": "Chemistry",
            "academicYear": "senior",
            "financialAid": "Other Scholarships",
            "familyIncome": 27002,
            "achievements": [
                "Placed in the top 5% in the International Chemistry Olympiad",
                " won the State Physics Olympiad",
                " honored with the Dean\u2019s List Award for Outstanding Academic Performance",
                " secured first place in the University Math Competition."
            ],
            "extracurricular": [
                "As a member of the University Debate Team",
                " I have honed my critical thinking and public speaking skills. I actively volunteer at the local community center and am a proud member of the Environmental Awareness Club. Through these roles",
                " I have organized several charity events for the Red Cross",
                " helping to address pressing social issues within our community."
            ],
            "essay": "I hope this letter finds you well. My name is Manuel Christopher Moody, and I am a senior majoring in Chemistry at [Your University]. I am writing to express my earnest desire to be considered for [Name of Scholarship], as it represents a pivotal opportunity for me to further my education and contribute meaningfully to my community.\r\n\r\nI am proud to share that my academic journey has been marked by dedication and achievement. I maintain a GPA of 3.63, positioning me in the top tier of my class. My academic performance has earned me significant recognition, including placing in the top 5% in the International Chemistry Olympiad and winning the State Physics Olympiad. Additionally, I have been honored with the Dean\u2019s List Award for Outstanding Academic Performance and secured first place in the University Math Competition. These accomplishments reflect my unwavering commitment to academic excellence and my passion for the sciences.\r\n\r\nAs a first-generation college student, my education is not only a personal milestone but also a testament to the hard work of my family, who currently face a challenging annual income of $27,002. While I am grateful for my current financial aid, which includes another scholarship, I understand that continued support is essential for me to thrive in my studies without the burden of financial stress. This scholarship would allow me to focus entirely on my academic pursuits and community involvement without distraction.\r\n\r\nIn addition to my academic achievements, I am deeply committed to extracurricular activities that enrich my personal development and foster a sense of community. As a member of the University Debate Team, I have honed my critical thinking and public speaking skills. I actively volunteer at the local community center and am a proud member of the Environmental Awareness Club. Through these roles, I have organized several charity events for the Red Cross, helping to address pressing social issues within our community. My experiences have not only equipped me with essential life skills but also reinforced my resolve to contribute positively to society.\r\n\r\nLooking forward, my goal is to leverage my education in chemistry to emerge as a leader in public health. I aspire to develop innovative solutions that will advance public wellness and improve health outcomes, particularly for underrepresented populations. This scholarship is crucial for me to fulfill that dream, enabling me to focus on my academics while continuing my service to the community.\r\n\r\nI would like to express my gratitude for considering my application for the [Name of Scholarship]. I am hopeful that my passion for chemistry, demonstrated leadership in academics and community service, and my dedication to making a positive impact will resonate with the committee.\r\n\r\nPlease feel free to contact my academic reference, Dr. William Charles, at ryanfletcher@hotmail.com for any further insights regarding my qualifications and aspirations.\r\n\r\nThank you for your time and consideration. I look forward to the opportunity to contribute to my field and community as part of your esteemed program.\r\n\r\nWarmest regards,\r\nManuel Christopher Moody\r\nStudent ID: 45123296\r\n[Your Contact Number]\r\n[Your LinkedIn Profile or Personal Website] (if applicable)",
            "reference1": "",
            "reference1Email": "",
            "submission_time": "2025-11-04 16:35:19"
        }
    },
    {
        "task": 23,
        "model": "qwen3-vl-flash",
        "dur": 128.57419395446777,
        "step": 19,
        "result": {
            "firstName": "April",
            "middleName": "Harold",
            "lastName": "Kelly",
            "studentId": 43526453,
            "gpa": 2.76,
            "major": "Mathematics",
            "academicYear": "senior",
            "financialAid": "None",
            "familyIncome": "$69,936",
            "achievements": [
                "I proudly secured the first place in the University Math Competition",
                " an experience that sharpened my problem-solving skills and allowed me to utilize my mathematical knowledge in a competitive setting. Additionally",
                " I contributed to the academic community by publishing a research paper in the International Journal of Engineering",
                " which further strengthened my analytical and research capabilities."
            ],
            "extracurricular": [
                "As a member of the University Debate Team",
                " I have honed my public speaking and critical thinking skills",
                " finding that engaging in discourse and diverse perspectives enhances my own understanding of complex issues. Additionally",
                " my involvement in the Environmental Awareness Club reflects my commitment to sustainability and social responsibility",
                " an interest that aligns with my long-term goals."
            ],
            "essay": "I am writing to express my sincere interest in applying for the scholarship opportunity provided by your esteemed organization. My name is April Harold Kelly, a dedicated senior currently pursuing a degree in Mathematics. Although my current GPA stands at 2.76, I have consistently engaged in rigorous academic and extracurricular activities, demonstrating my commitment to both my field of study and my overall personal development.\\n\\nThroughout my academic journey, I have had notable achievements that underscore my passion for mathematics and its applications. I proudly secured the first place in the University Math Competition, an experience that sharpened my problem-solving skills and allowed me to utilize my mathematical knowledge in a competitive setting. Additionally, I contributed to the academic community by publishing a research paper in the International Journal of Engineering, which further strengthened my analytical and research capabilities.\\n\\nBeyond academics, I actively participate in extracurricular activities that enrich my university experience. As a member of the University Debate Team, I have honed my public speaking and critical thinking skills, finding that engaging in discourse and diverse perspectives enhances my own understanding of complex issues. Additionally, my involvement in the Environmental Awareness Club reflects my commitment to sustainability and social responsibility, an interest that aligns with my long-term goals.\\n\\nHowever, despite my dedication and achievements, I face financial challenges that could impede my continued education. My family\u2019s annual income is $69,936, and currently, I do not receive any financial aid, placing significant pressure on me as I approach the culmination of my studies. This scholarship would alleviate some of that burden, allowing me to focus on my academic pursuits without the constraints of financial worries.\\n\\nMy statement of purpose encapsulates the essence of my academic journey: I am deeply passionate about advancing my knowledge in the field of environmental science. This scholarship will enable me to continue my studies without the pressure of financial burdens, allowing me to apply the insights I gain towards making a tangible impact in sustainable development.\\n\\nI would be genuinely grateful for the opportunity to honor this scholarship and the values it represents. I have consistently worked hard to exemplify what it means to be a conscientious student and a contributing member of my community.  \\n\\nFor any further information, please contact my academic reference, Lisa Taylor, at wbailey@johnson.net.\\n\\nThank you for considering my application. I am hopeful for the opportunity to further my education and, in doing so, contribute positively to my community and beyond.\\n\\nSincerely,\\nApril Harold Kelly",
            "reference1": "",
            "reference1Email": "",
            "submission_time": "2025-11-04 16:37:38"
        }
    },
    {
        "task": 24,
        "model": "qwen3-vl-flash",
        "dur": 80.82348370552063,
        "step": 14,
        "result": {
            "firstName": "Kimberly",
            "middleName": "Laura",
            "lastName": "Harmon",
            "studentId": 16505423,
            "gpa": 2.7,
            "major": "Chemistry",
            "academicYear": "sophomore",
            "financialAid": "Student Loans",
            "familyIncome": "$64,101",
            "achievements": [
                "Throughout my educational journey",
                " I have consistently embraced opportunities to challenge myself and broaden my horizons. Two of my proudest achievements include being a finalist in the National Robotics Championship and winning the National Science Fair. These experiences have not only reinforced my passion for the sciences but have also inspired me to integrate innovative approaches into problem-solving and community challenges."
            ],
            "extracurricular": [
                "As the President of the Student Council",
                " I have honed my skills in governance",
                " team collaboration",
                " and community outreach. My role as a co-founder of the Campus Startup Initiative has allowed me to engage with fellow students and faculty",
                " fostering an entrepreneurial spirit that I believe is vital for addressing today\u2019s societal issues."
            ],
            "essay": "As a first-generation college student, I face financial constraints that can hinder my ability to pursue academic excellence. This scholarship is crucial for me to continue my education uninterrupted, allowing me to focus wholeheartedly on my studies and extracurricular projects. With your support, I aspire to contribute meaningfully to community service initiatives and solidify my path towards becoming a leader in public health. The significance of this scholarship extends beyond financial relief; it embodies the hope of transforming my dreams into reality. With each passing semester, I am more committed to acquiring knowledge in chemistry, which I intend to leverage in public health settings. Your consideration of my application will not only impact my academic journey but also enable me to give back to my community in profound ways.",
            "reference1": "Samuel Rodgers",
            "reference1Email": "clarkdonald@gmail.com",
            "submission_time": "2025-11-04 16:38:59"
        }
    },
    {
        "task": 25,
        "model": "qwen3-vl-flash",
        "dur": 93.08072924613953,
        "step": 18,
        "result": {
            "firstName": "Anne",
            "middleName": "Christopher",
            "lastName": "Curtis",
            "studentId": 39484068,
            "gpa": 3.72,
            "major": "Computer Science",
            "academicYear": "sophomore",
            "financialAid": "",
            "familyIncome": 20748,
            "achievements": [],
            "extracurricular": [],
            "essay": "",
            "reference1": "",
            "reference1Email": "",
            "submission_time": "2025-11-04 16:40:44"
        }
    },
    {
        "task": 26,
        "model": "qwen3-vl-flash",
        "dur": 150.96528482437134,
        "step": 18,
        "result": {
            "firstName": "Tamara",
            "middleName": "Angel",
            "lastName": "Howe",
            "studentId": 41008844,
            "gpa": 2.96,
            "major": "English Literature",
            "academicYear": "sophomore",
            "financialAid": "Other Scholarships",
            "familyIncome": "$80,469",
            "achievements": [
                "Winner of the State Physics Olympiad",
                " Dean's List for Outstanding Academic Performance",
                " First Place in University Math Competition"
            ],
            "extracurricular": [
                "President of Student Council",
                " Member of Environmental Awareness Club promoting sustainable practices."
            ],
            "essay": "I am writing to express my sincere interest in the scholarship opportunity available for motivated students such as myself. My name is Tamara Angel Howe, and I am currently a sophomore majoring in English Literature with a GPA of 2.96 at my university. As I embark on this critical phase of my academic and professional journey, I am eager to articulate how this scholarship will both alleviate financial burdens and enable me to fulfill my ambitions.\r\n\r\nThroughout my academic experience, I have demonstrated a commitment to excellence that is underscored by several notable achievements. I had the honor of being the winner of the State Physics Olympiad, an experience that not only sharpened my analytical skills but also instilled in me a deep appreciation for interdisciplinary studies. Additionally, securing a spot on the Dean\u2019s List for Outstanding Academic Performance and earning first place in the University Math Competition have further solidified my resolve to excel in both my studies and extracurricular endeavors.\r\n\r\nOutside the classroom, I am passionately involved in enriching my university community and beyond. As a member of the Environmental Awareness Club, I have participated in initiatives aimed at promoting sustainable practices among my peers, fostering a sense of responsibility towards our planet. My leadership skills have also been honed through my role as the President of the Student Council, where I actively advocate for student needs and organize events that enhance campus life.\r\n\r\nAs I continue my studies in English Literature, my long-term goal is to pivot towards a career in data science. I believe that the analytical skills I have developed through interdisciplinary learning combined with a strong literary foundation will empower me to contribute effectively to tackling complex global challenges. This scholarship will be instrumental in allowing me to concentrate fully on my academic pursuits without the impending concern of financial constraints.\r\n\r\nI have great respect for the journey each student embarks upon, and I am eager to take full advantage of the opportunity this scholarship provides. It will enable me to align my academic experiences with my future career aspirations seamlessly. My academic reference, Mary McFarland, can provide further insights into my character and capabilities at her email, dmckenzie@hudson-johnson.biz.\r\n\r\nThank you for considering my application. I am thrilled about the possibility of receiving support that will allow me to fully dedicate myself to my studies and engage with my community in meaningful ways.\r\n\r\nSincerely,\r\nTamara Angel Howe",
            "reference1": "",
            "reference1Email": "",
            "submission_time": "2025-11-04 16:43:21"
        }
    },
    {
        "task": 27,
        "model": "qwen3-vl-flash",
        "dur": 92.92016172409058,
        "step": 18,
        "result": {
            "firstName": "Joel",
            "middleName": "Gwendolyn",
            "lastName": "Herrera",
            "studentId": 18498388,
            "gpa": 3.23,
            "major": "Computer Science",
            "academicYear": "junior",
            "financialAid": "Student Loans",
            "familyIncome": 43355,
            "achievements": [
                "Published a research paper in the International Journal of Engineering",
                " competed as a finalist in the National Robotics Championship",
                " and earned the Dean\u2019s List Award for Outstanding Academic Performance."
            ],
            "extracurricular": [
                "Volunteer at the local community center",
                " organizing charity events for the Red Cross",
                " and serve as a co-founder of the Campus Startup Initiative."
            ],
            "essay": "",
            "reference1": "",
            "reference1Email": "",
            "submission_time": "2025-11-04 16:45:01"
        }
    },
    {
        "task": 28,
        "model": "qwen3-vl-flash",
        "dur": 156.09073519706726,
        "step": 20,
        "result": {
            "firstName": "Cynthia",
            "middleName": "Monica",
            "lastName": "Jacobs",
            "studentId": 34653885,
            "gpa": 3.63,
            "major": "Environmental Science",
            "academicYear": "senior",
            "financialAid": "Student Loans",
            "familyIncome": 51089,
            "achievements": [
                "First place in University Math Competition",
                " Research published in International Journal of Engineering",
                " Finalist in National Robotics Championship",
                " Winner of State Physics Olympiad"
            ],
            "extracurricular": [
                "Volunteered at local community center",
                " Coordinator of Youth Empowerment Program",
                " President of Student Council"
            ],
            "essay": "Dear Scholarship Committee,\r\n\r\nI am writing to express my sincere interest in applying for the scholarship opportunity that can immensely aid me in pursuing my academic and career aspirations. My name is Cynthia Monica Jacobs, and I am currently a senior majoring in Environmental Science at [Your University Name]. With a GPA of 3.63, I am dedicated to my studies and committed to making a positive impact in my community and the broader environmental field.\r\n\r\nAs a first-generation college student, financial challenges have always been a part of my journey. Currently, my academic pursuits are supported primarily through student loans, and my family's annual income is $51,089. Receiving this scholarship would not only alleviate my financial burden but also enable me to concentrate fully on my academic and extracurricular engagements without the constant worry of financial constraints. This support could potentially turn my dreams into a reality, allowing me to achieve excellence in my studies while actively participating in community service initiatives.\r\n\r\nMy academic journey has been enriched by various achievements that reflect my commitment to excellence. I was honored to take first place in the University Math Competition and to have my research published in the International Journal of Engineering. Additionally, I was a finalist in the National Robotics Championship, which fostered my problem-solving skills and my ability to work collaboratively in a team environment. My winning achievement at the State Physics Olympiad not only validated my dedication to the sciences but also motivated me to use this knowledge to impact public health positively.\r\n\r\nBeyond academics, I am equally passionate about engaging with my community. I have volunteered at the local community center, where I have had the privilege of giving back and supporting those in need. In my role as the Coordinator of the Youth Empowerment Program, I strive to inspire young people by providing opportunities for personal and academic growth, aligning closely with my desire to be a leader in public health. Furthermore, as the President of the Student Council, I have learned valuable leadership skills, including teamwork, organization, and advocating for my peers' needs.\r\n\r\nIn conclusion, this scholarship represents a beacon of hope for me. It is essential not just for easing my financial pressures, but also for ensuring that I can channel my energy into my studies and community work effectively. I am determined to utilize my education in Environmental Science to develop innovative solutions that promote public health and environmental sustainability. Your support would bring me a step closer to fulfilling this ambition.\r\n\r\nI would like to express my gratitude for considering my application. I am looking forward to the possibility of contributing positively to both my field and the community. For further information or insights into my qualifications, please feel free to contact my academic reference, Robin Thomas, at rjones@hotmail.com.\r\n\r\nThank you for your time and consideration.\r\n\r\nSincerely,\r\nCynthia Monica Jacobs\r\nStudent ID: 34653885\r\n[Your University Name]",
            "reference1": "",
            "reference1Email": "",
            "submission_time": "2025-11-04 16:47:39"
        }
    },
    {
        "task": 29,
        "model": "qwen3-vl-flash",
        "dur": 65.26377010345459,
        "step": 10,
        "result": {
            "firstName": "Donna",
            "middleName": "Christopher",
            "lastName": "Perry",
            "studentId": 75262573,
            "gpa": 3.48,
            "major": "Business Administration",
            "academicYear": "freshman",
            "financialAid": "None",
            "familyIncome": 24695,
            "achievements": [
                "Won the National Science Fair and secured first place in the University Math Competition"
            ],
            "extracurricular": [
                "Volunteer at the local community center",
                " co-founded the Campus Startup Initiative",
                " and am a proud member of the Environmental Awareness Club"
            ],
            "essay": "I am writing to apply for the scholarship opportunity available to students pursuing a degree in Business Administration. My name is Donna Christopher Perry, and I am a freshman majoring in Business Administration at your institution. I have maintained a current GPA of 3.48, and I am dedicated to achieving academic excellence in my field of study. Despite facing financial challenges, I have not let it hinder my academic pursuits. I am currently not receiving any financial aid, and my family's annual income is $24,695. In addition to my academic achievements, which include winning the National Science Fair and securing first place in the University Math Competition, I am actively involved in various extracurricular activities. I volunteer at the local community center, co-founded the Campus Startup Initiative, and am a proud member of the Environmental Awareness Club. Receiving this scholarship would significantly alleviate the financial burden on my family and allow me to fully focus on my studies. It will help me achieve my career goals in data science, where I aspire to make a meaningful contribution to addressing global challenges. My academic referee, Michelle Franklin, can attest to my dedication and commitment to my studies. You may contact her at gonzalezjulia@smith.com for any further information regarding my academic pursuits. I am truly grateful for your consideration and the opportunity to apply for this scholarship. Thank you for your time and consideration.",
            "reference1": "",
            "reference1Email": "",
            "submission_time": "2025-11-04 16:48:47"
        }
    },
    {
        "task": 30,
        "model": "qwen3-vl-flash",
        "dur": 81.16478180885315,
        "step": 19,
        "result": {
            "firstName": "Christine",
            "middleName": "Danielle",
            "lastName": "Williams",
            "studentId": 68200283,
            "gpa": 2.8,
            "major": "Mechanical Engineering",
            "academicYear": "sophomore",
            "financialAid": "",
            "familyIncome": 50968,
            "achievements": [],
            "extracurricular": [],
            "essay": "",
            "reference1": "",
            "reference1Email": "",
            "submission_time": "2025-11-04 16:50:20"
        }
    },
    {
        "task": 31,
        "model": "qwen3-vl-flash",
        "dur": 90.93564796447754,
        "step": 19,
        "result": {
            "firstName": "Jesus",
            "middleName": "Tonya",
            "lastName": "Obrien",
            "studentId": 46036603,
            "gpa": 3.19,
            "major": "Biology",
            "academicYear": "sophomore",
            "financialAid": "Grants",
            "familyIncome": 47600,
            "achievements": [
                "Winner of the National Science Fair",
                " Dean\u2019s List Award for Outstanding Academic Performance",
                " Ranked in the top 5% in the International Chemistry Olympiad",
                " First Place in the University Math Competition"
            ],
            "extracurricular": [
                "Volunteer at the local community center",
                " Coordinator of the Youth Empowerment Program",
                " Participant in the University Debate Team",
                " Member of the Environmental Awareness Club"
            ],
            "essay": "Dear Scholarship Selection Committee,\r\n\r\nMy name is Jesus Tonya Obrien, and I am currently a sophomore majoring in Biology at our esteemed institution. I am excited to submit my application for your scholarship opportunity, as I am eager to continue my academic journey and further my passion for learning and research.\r\n\r\nThroughout my time as a student, I have consistently maintained a GPA of 3.19 and have been fortunate to receive grants as part of my financial aid package. However, with an annual family income of $47,600, additional financial support would greatly ease the burden of tuition and expenses, allowing me to focus more on my studies and extracurricular activities.\r\n\r\nIn terms of my academic achievements, I am proud to have been recognized as the winner of the National Science Fair, received the Dean\u2019s List Award for Outstanding Academic Performance, ranked in the top 5% in the International Chemistry Olympiad, and secured first place in the University Math Competition. These achievements are a testament to my dedication, hard work, and commitment to excellence in my studies.\r\n\r\nBeyond the classroom, I am actively involved in various extracurricular activities that allow me to give back to the community and further develop my leadership skills. I volunteer at the local community center, serve as the coordinator of the Youth Empowerment Program, participate in the University Debate Team, and am a member of the Environmental Awareness Club. These experiences have not only enriched my college experience but have also taught me valuable life lessons about teamwork, communication, and social responsibility.\r\n\r\nMy statement of purpose reflects my deep interest in computer engineering and my aspirations to conduct research in cutting-edge technologies. I am confident that receiving this scholarship will provide me with the resources necessary to pursue my academic goals and ultimately achieve my long-term career ambitions of innovating in the tech industry.\r\n\r\nI am grateful to have Cindy Bailey as my academic reference, and I have also provided her contact information should you need further verification of my academic and personal qualities.\r\n\r\nThank you for considering my application. I am truly grateful for the opportunity to be considered for this scholarship and look forward to the possibility of continuing my education with your support.\r\n\r\nSincerely,\r\n\r\nJesus Tonya Obrien\r\nStudent ID: 46036603\r\nEmail: tonya.obrien@email.com",
            "reference1": "",
            "reference1Email": "",
            "submission_time": "2025-11-04 16:51:57"
        }
    },
    {
        "task": 32,
        "model": "qwen3-vl-flash",
        "dur": 84.71037912368774,
        "step": 14,
        "result": {
            "firstName": "Alexander",
            "middleName": "Michael",
            "lastName": "Koch",
            "studentId": 986084,
            "gpa": 2.94,
            "major": "Political Science",
            "academicYear": "senior",
            "financialAid": "Grants",
            "familyIncome": 27884,
            "achievements": [
                "Recognized on the Dean's List for outstanding performance and secured first place in the University Math Competition"
            ],
            "extracurricular": [
                "Co-founder of the Campus Startup Initiative",
                " member of the Environmental Awareness Club",
                " University Debate Team",
                " and coordinator of the Youth Empowerment Program."
            ],
            "essay": "Dear Scholarship Committee,\r\n\r\nMy name is Alexander Michael Koch, and I am a senior majoring in Political Science at our esteemed university. I am writing to apply for the scholarship opportunity available to support my academic journey.\r\n\r\nI come from a humble background with an annual family income of $27,884. Currently, my academic achievements include being recognized on the Dean's List for outstanding performance and securing the first place in the University Math Competition. These accomplishments demonstrate my commitment to excellence in my studies.\r\n\r\nApart from my academic pursuits, I am extensively involved in extracurricular activities on campus. I am the co-founder of the Campus Startup Initiative, a member of the Environmental Awareness Club, the University Debate Team, and also serve as the coordinator of the Youth Empowerment Program. These activities have not only broadened my horizons but have also enhanced my leadership and communication skills.\r\n\r\nMy GPA stands at 2.94, and I currently rely on grants for financial aid. However, this scholarship would alleviate the financial burden on my family and me, allowing me to focus solely on my studies and complete my degree successfully. My ultimate goal is to pursue a career in data science, where I aspire to contribute towards solving global challenges.\r\n\r\nI am confident in my ability to excel in this field, given my passion for learning and dedication to making a difference. I am grateful for your consideration of my application and would like to express my appreciation to my academic reference, Christy Jordan, whose contact email is melissa61@gmail.com.\r\n\r\nThank you for this opportunity to apply for the scholarship. I look forward to the possibility of contributing to the betterment of our society through the knowledge and skills I gain during my academic journey.\r\n\r\nSincerely,\r\nAlexander Michael Koch (Student ID: 986084)",
            "reference1": "",
            "reference1Email": "",
            "submission_time": "2025-11-04 16:53:23"
        }
    },
    {
        "task": 33,
        "model": "qwen3-vl-flash",
        "dur": 108.87020373344421,
        "step": 20,
        "result": {
            "firstName": "Nathaniel",
            "middleName": "Candice",
            "lastName": "Miller",
            "studentId": 21775094,
            "gpa": 3.38,
            "major": "Chemistry",
            "academicYear": "freshman",
            "financialAid": "Other Scholarships",
            "familyIncome": 54075,
            "achievements": [
                "Winning the State Physics Olympiad",
                " being a finalist in the National Robotics Championship",
                " publishing a research paper in the International Journal of Engineering",
                " and receiving the Dean's List Award for Outstanding Academic Performance."
            ],
            "extracurricular": [
                "Served as President of the Student Council",
                " organized charity events for the Red Cross",
                " member of the Environmental Awareness Club",
                " and University Debate Team."
            ],
            "essay": "Dear Scholarship Committee,\r\n\r\nMy name is Nathaniel Candice Miller, and I am a freshman majoring in Chemistry at your esteemed institution. I am writing to apply for the scholarship opportunity available to assist students like myself in achieving their academic and career goals.\r\n\r\nI currently hold a GPA of 3.38 and am the recipient of another scholarship for my academic pursuits. Despite this support, my annual family income is only $54,075, making it challenging to cover all the expenses associated with pursuing a degree in Chemistry. This scholarship would alleviate the financial burden on my family and allow me to focus more on my studies and future research projects.\r\n\r\nThroughout my academic journey, I have excelled in various fields, including winning the State Physics Olympiad, being a finalist in the National Robotics Championship, and publishing a research paper in the International Journal of Engineering. I have also received the Dean's List Award for Outstanding Academic Performance. These achievements showcase my dedication to academic excellence and my passion for continuous learning and exploration.\r\n\r\nIn addition to my academic achievements, I am actively involved in extracurricular activities on campus. I serve as the President of the Student Council and have organized charity events for the Red Cross. I am also a member of the Environmental Awareness Club and the University Debate Team, where I have honed my leadership, communication, and teamwork skills.\r\n\r\nMy ultimate goal is to pursue a career in computer engineering, where I can innovate and contribute to cutting-edge technologies. This scholarship will provide me with the necessary resources to further my education and conduct research in my field of interest. With the support of this scholarship, I am confident that I can achieve my long-term career goals and make a positive impact in the tech industry.\r\n\r\nI have included Brittany Avila as my academic reference, who can attest to my academic abilities, dedication, and passion for learning. Should you require any further information, please do not hesitate to contact me at fieldssteven@gmail.com.\r\n\r\nThank you for considering my application. I am grateful for the opportunity to be considered for this scholarship and am confident that with your support, I can continue to excel in my academic pursuits.\r\n\r\nSincerely,\r\nNathaniel Candice Miller (Student ID: 21775094)",
            "reference1": "",
            "reference1Email": "",
            "submission_time": "2025-11-04 16:55:23"
        }
    },
    {
        "task": 34,
        "model": "qwen3-vl-flash",
        "dur": 103.15577983856201,
        "step": 20,
        "result": {
            "firstName": "Colleen",
            "middleName": "Grace",
            "lastName": "Adams",
            "studentId": 48297295,
            "gpa": 3.6,
            "major": "Economics",
            "academicYear": "junior",
            "financialAid": "Grants",
            "familyIncome": 86024,
            "achievements": [
                "Winner of the National Science Fair and recipient of the Dean's List Award for Outstanding Academic Performance"
            ],
            "extracurricular": [
                "Member of the University Debate Team",
                " volunteer at the local community center",
                " coordinator of the Youth Empowerment Program",
                " and President of the Student Council"
            ],
            "essay": "Dear Scholarship Committee,\r\n\r\nMy name is Colleen Grace Adams, and I am a Junior majoring in Economics at your esteemed institution. My student ID is 48297295, and I currently maintain a GPA of 3.6. As a recipient of grants for my current financial aid, my family's annual income is $86,024. I am proud to share that I have achieved success in my academic pursuits, including being the Winner of the National Science Fair and receiving the Dean's List Award for Outstanding Academic Performance.\r\n\r\nIn addition to my academic achievements, I am actively involved in various extracurricular activities. I am a member of the University Debate Team, a volunteer at the local community center, the coordinator of the Youth Empowerment Program, and the President of the Student Council. These experiences have shaped me into a well-rounded individual with a passion for making a positive impact in both academic and community settings.\r\n\r\nI am writing to apply for this scholarship opportunity because, as a first-generation college student, it is crucial for me to continue my education. This scholarship will provide me with the necessary financial support to focus on academic excellence while continuing to contribute to community service initiatives. My ultimate goal is to become a leader in public health, and this scholarship will help me inch closer to realizing that dream.\r\n\r\nFor my academic reference, you may contact Deborah Martinez at dennisjensen@barnes.com. I trust that she will attest to my dedication, hard work, and potential to excel in my field of study.\r\n\r\nI am confident that with this scholarship, I can continue to strive for excellence in both my academic and extracurricular endeavors. Thank you for considering my application. I look forward to the opportunity to further discuss how this scholarship will impact my educational journey positively.\r\n\r\nSincerely,\r\nColleen Grace Adams",
            "reference1": "",
            "reference1Email": "",
            "submission_time": "2025-11-04 16:57:07"
        }
    },
    {
        "task": 35,
        "model": "qwen3-vl-flash",
        "dur": 67.07020783424377,
        "step": 17,
        "result": {
            "firstName": "Sarah",
            "middleName": "Angela",
            "lastName": "Martin",
            "studentId": 93338661,
            "gpa": 3.0,
            "major": "Environmental Science",
            "academicYear": "junior",
            "financialAid": "Grants",
            "familyIncome": 74730,
            "achievements": [
                "Placed in the top 5% of the International Chemistry Olympiad and published a research paper in the International Journal of Engineering"
            ],
            "extracurricular": [
                "Served as President of the Student Council",
                " organizing charity events for the Red Cross and coordinating the Youth Empowerment Program."
            ],
            "essay": "This scholarship will provide me the resources to further my education and conduct research in cutting-edge technologies, helping me achieve my long-term career goals of innovating in the tech industry. With access to enhanced academic resources, I am eager to develop innovative strategies to address pressing environmental challenges.",
            "reference1": "",
            "reference1Email": "",
            "submission_time": "2025-11-04 16:58:20"
        }
    },
    {
        "task": 36,
        "model": "qwen3-vl-flash",
        "dur": 99.77227020263672,
        "step": 18,
        "result": {
            "firstName": "Paul",
            "middleName": "Charles",
            "lastName": "Perez",
            "studentId": 40075028,
            "gpa": 3.97,
            "major": "Law",
            "academicYear": "junior",
            "financialAid": "Other Scholarships",
            "familyIncome": 31161,
            "achievements": [
                "I have been included on the Dean\u2019s List for Outstanding Academic Performance",
                " won first place in the University Math Competition",
                " and was recognized as a winner at the National Science Fair. I also published a research paper in the International Journal of Engineering."
            ],
            "extracurricular": [
                "I volunteer at the local community center",
                " assisting with programs for underprivileged individuals. I am also a member of the University Debate Team",
                " which has helped me develop critical thinking and public speaking skills essential for a legal career."
            ],
            "essay": "I am writing to express my sincere interest in applying for the [Name of Scholarship]. As a dedicated Junior majoring in Law with a current GPA of 3.97, I am eager to leverage this scholarship to further enrich my educational journey and contribute meaningfully to my field of study and community. Throughout my academic career, I have consistently pursued excellence, evidenced by my inclusion on the Dean\u2019s List for Outstanding Academic Performance and several accolades that I have achieved, including winning first place in the University Math Competition and being recognized as a winner at the National Science Fair. Additionally, I take pride in having published a research paper in the International Journal of Engineering, underscoring my commitment to inquiry and academic rigor. In addition to my academic pursuits, I actively engage in extracurricular activities that not only enhance my university experience but also allow me to give back to the community. I volunteer at the local community center, where I assist various programs aimed at supporting underprivileged individuals. Furthermore, my involvement as a member of the University Debate Team has honed my critical thinking and public speaking skills, equipping me with invaluable tools that are essential for success in the legal field. Notably, my current financial situation necessitates support; my family's annual income of $31,161 requires me to seek alternative financial resources. While I currently receive an Other Scholarship, this support is crucial in helping me manage my educational costs and minimizing the financial burden on my family. Receiving the [Name of Scholarship] will provide me with the additional resources needed not only to continue excelling academically but to engage more deeply in my passion for law. My steadfast dedication to my studies is complemented by my aspiration to make a positive impact in the legal community, particularly in areas that intersect with underrepresented groups. I am committed to using the education and experiences I gain to advocate for justice and equity. I am fortunate to have the support of my academic reference, Kenneth Novak, who can attest to my dedication and performance. He can be reached at vhurley@potts.info for any inquiries regarding my application. Thank you for considering my application. I am hopeful for the opportunity to contribute positively through your scholarship and look forward to your favorable response.",
            "reference1": "",
            "reference1Email": "",
            "submission_time": "2025-11-04 17:00:10"
        }
    },
    {
        "task": 37,
        "model": "qwen3-vl-flash",
        "dur": 103.80737471580505,
        "step": 18,
        "result": {
            "firstName": "Michael",
            "middleName": "Micheal",
            "lastName": "Bean",
            "studentId": 82014820,
            "gpa": 3.91,
            "major": "Chemistry",
            "academicYear": "freshman",
            "financialAid": "Student Loans",
            "familyIncome": 46136,
            "achievements": [
                "Ranked in the top 5% of the International Chemistry Olympiad and secured first place in the University Math Competition"
            ],
            "extracurricular": [
                "Coordinator of the Youth Empowerment Program; organized charity events for the Red Cross"
            ],
            "essay": "My name is Michael Micheal Bean, and I am a freshman student majoring in Chemistry at your esteemed institution. My student ID is 82014820, and I am currently maintaining an impressive GPA of 3.91. I am writing to express my sincere interest in applying for the scholarship opportunity available to students in need of financial assistance. Currently, my family's annual income is $46,136, and I am relying on student loans to fund my education. This scholarship would greatly alleviate the financial burden on both myself and my family, allowing me to focus more on my academic pursuits. In terms of academic achievements, I have excelled in various competitions, ranking in the top 5% of the International Chemistry Olympiad and securing first place in the University Math Competition. Moreover, I am actively engaged in extracurricular activities as the Coordinator of the Youth Empowerment Program and have organized charity events for the Red Cross, demonstrating my commitment to giving back to the community. My passion lies in environmental science, and I am dedicated to advancing my knowledge in this field to contribute towards sustainable development. The scholarship will provide me with the opportunity to delve deeper into my studies and equip me with the necessary skills to make a tangible impact in the realm of environmental sustainability. I am confident that with this scholarship, I will be able to achieve my academic and career goals, and ultimately give back to society in a meaningful way. I am also grateful to have the support of my academic reference, Rachael Moreno, whose contact email is ferrellrobert@rollins-hudson.com. Thank you for considering my application. I look forward to the opportunity to further my education and make a positive difference in the world.",
            "reference1": "",
            "reference1Email": "",
            "submission_time": "2025-11-04 17:02:00"
        }
    },
    {
        "task": 38,
        "model": "qwen3-vl-flash",
        "dur": 109.44033908843994,
        "step": 19,
        "result": {
            "firstName": "Gregory",
            "middleName": "Laura",
            "lastName": "White",
            "studentId": 43067727,
            "gpa": 2.87,
            "major": "Sociology",
            "academicYear": "senior",
            "financialAid": "Grants",
            "familyIncome": 99575,
            "achievements": [
                "Dean\u2019s List Award for Outstanding Academic Performance",
                " Finalist in the National Robotics Championship",
                " Top 5% in the International Chemistry Olympiad",
                " Winner of the National Science Fair"
            ],
            "extracurricular": [
                "Volunteering at the community center for outreach programs to uplift underprivileged neighborhoods",
                " Organizing charity events for the Red Cross to deepen understanding of social issues and foster commitment to community service"
            ],
            "essay": "I am writing to apply for the scholarship that aims to support passionate and dedicated students like myself. My name is Gregory Laura White, and I am currently a senior majoring in Sociology. Throughout my academic journey, I have always been driven to excel and make a positive impact on society. With a GPA of 2.87, I have continuously sought to challenge myself and expand my horizons, which is reflected in my academic achievements. I have been fortunate to receive recognition for my efforts, such as the Dean\u2019s List Award for Outstanding Academic Performance, which highlights my dedication and hard work. Additionally, I take pride in being a finalist in the National Robotics Championship and placing in the top 5% in the International Chemistry Olympiad. These experiences have not only honed my analytical and problem-solving skills but also taught me the importance of collaboration and innovation. Furthermore, being a winner of the National Science Fair has fueled my passion for learning and exploration within various fields of study. As a well-rounded student, I fine-tune my leadership and interpersonal skills through various extracurricular activities. I contribute to my local community by volunteering at the community center, where I assist in outreach programs that aim to uplift and support underprivileged neighborhoods. Furthermore, I have taken on the responsibility of organizing charity events for the Red Cross, which has deepened my understanding of social issues and fostered my commitment to community service. The purpose of this scholarship extends beyond financial assistance for my education. I harbored a deep passion for environmental science, and this scholarship will enable me to continue my studies without the pressure of financial burdens. With the knowledge I cultivate, I aspire to make a substantial impact in sustainable development. This vision aligns perfectly with my long-term goals of advocating for responsible social and environmental policies that prioritize community wellbeing and ecological health. I have sought guidance from esteemed educators throughout my academic career, and I have been fortunate to have mentors like Alexander Terry, who has greatly influenced my studies and aspirations. He would be glad to provide a reference regarding my academic performance and dedication to my field of study, and can be reached at joseph77@hotmail.com. As I reflect on my journey thus far, I am deeply motivated to further my education in a way that positively influences the world around me. This scholarship will provide me with the opportunity to fulfill this goal, ensuring that financial constraints do not hinder my academic pursuits. Thank you for considering my application. I am eager to potentially represent your esteemed scholarship program, and I look forward to the prospect of making a meaningful contribution to our society through my studies.",
            "reference1": "",
            "reference1Email": "",
            "submission_time": "2025-11-04 17:03:56"
        }
    },
    {
        "task": 39,
        "model": "qwen3-vl-flash",
        "dur": 125.42619109153748,
        "step": 16,
        "result": {
            "firstName": "Brittany",
            "middleName": "Marie",
            "lastName": "Valentine",
            "studentId": 45034587,
            "gpa": 3.18,
            "major": "Business Administration",
            "academicYear": "freshman",
            "financialAid": "Other Scholarships",
            "familyIncome": 64977,
            "achievements": [
                "Winning the State Physics Olympiad",
                " the National Science Fair",
                " publishing a research paper in the International Journal of Engineering",
                " and being in the top 5% of the International Chemistry Olympiad."
            ],
            "extracurricular": [
                "Volunteering at the local community center",
                " co-founding the Campus Startup Initiative",
                " and organizing charity events for the Red Cross."
            ],
            "essay": "Dear Scholarship Committee,\r\n\r\nMy name is Brittany Marie Valentine, and I am currently a freshman majoring in Business Administration with a current GPA of 3.18. I am writing to apply for the scholarship opportunity to further my education and career in the field of environmental science.\r\n\r\nGrowing up, I have always been passionate about environmental conservation and sustainability. My academic achievements, including winning the State Physics Olympiad, the National Science Fair, publishing a research paper in the International Journal of Engineering, and being in the top 5% of the International Chemistry Olympiad, reflect my dedication to learning and excelling in the sciences.\r\n\r\nIn addition to my academic achievements, I am actively involved in extracurricular activities such as volunteering at the local community center, co-founding the Campus Startup Initiative, and organizing charity events for the Red Cross. These experiences have not only enriched my understanding of community service but have also taught me the importance of leadership and teamwork.\r\n\r\nWith an annual family income of $64,977 and current financial aid being another scholarship, receiving this scholarship would greatly alleviate the financial burden on my family and allow me to focus on my studies and pursue my passion for environmental science without added pressures.\r\n\r\nI am committed to using the knowledge and skills gained through this scholarship to make a positive impact in sustainable development. My academic reference, Jenny Delgado, can attest to my dedication, hard work, and passion for environmental science. You can contact her at fhunter@gmail.com for any additional information.\r\n\r\nI am deeply grateful for your consideration of my application and the opportunity to further my education with your support. Thank you for considering my application.\r\n\r\nSincerely,\r\nBrittany Marie Valentine\r\n[Student ID: 45034587]",
            "reference1": "",
            "reference1Email": "",
            "submission_time": "2025-11-04 17:06:08"
        }
    },
    {
        "task": 40,
        "model": "qwen3-vl-flash",
        "dur": 90.93298006057739,
        "step": 20,
        "result": {
            "firstName": "Stephanie",
            "middleName": "Terri",
            "lastName": "Cervantes",
            "studentId": 12819097,
            "gpa": 3.51,
            "major": "Electrical Engineering",
            "academicYear": "freshman",
            "financialAid": "Other Scholarships",
            "familyIncome": 87199,
            "achievements": [
                "I am the winner of the National Science Fair and secured first place in the University Math Competition",
                " I have also been recognized with the Dean\u2019s List Award for Outstanding Academic Performance"
            ],
            "extracurricular": [
                "Member of the Environmental Awareness Club",
                " coordinated the Youth Empowerment Program",
                " served as President of the Student Council",
                " and co-founded the Campus Startup Initiative."
            ],
            "essay": "I am pleased to provide Jessica Wilson as my academic reference, who can attest to my dedication to my studies and my involvement in extracurricular activities. Her contact email is debbie86@gmail.com. I am sincerely grateful for your consideration of my application for this scholarship. I am confident that with your support, I will be able to continue my education and make a meaningful impact in my field and community.",
            "reference1": "",
            "reference1Email": "",
            "submission_time": "2025-11-04 17:07:46"
        }
    },
    {
        "task": 41,
        "model": "qwen3-vl-flash",
        "dur": 98.92404985427856,
        "step": 19,
        "result": {
            "firstName": "Raymond",
            "middleName": "Samuel",
            "lastName": "Smith",
            "studentId": 27522333,
            "gpa": 3.26,
            "major": "Electrical Engineering",
            "academicYear": "sophomore",
            "financialAid": "None",
            "familyIncome": 53495,
            "achievements": [
                "Finalist in the National Robotics Championship",
                " First place in the University Math Competition",
                " Published research paper in the International Journal of Engineering",
                " Winner of the National Science Fair"
            ],
            "extracurricular": [
                "Volunteer at the local community center organizing programs to improve community life. Member of the University Debate Team",
                " enhancing communication and critical thinking skills."
            ],
            "essay": "I am writing to express my earnest interest in the scholarship opportunity available through your esteemed organization. My name is Raymond Samuel Smith, a sophomore studying Electrical Engineering at [University Name], holding the Student ID 27522333. I am currently facing financial challenges that hinder my ability to fully dedicate myself to my studies and aspirations. This scholarship would provide me with the crucial support I need to continue on my educational journey.\r\n\r\nDespite my current GPA of 3.26, I am committed to academic excellence and have consistently participated in various challenging endeavors. Among my proudest achievements are being a finalist in the National Robotics Championship, securing first place in the University Math Competition, and publishing a research paper in the International Journal of Engineering. I also had the honor of winning the National Science Fair, further solidifying my passion for innovation and problem-solving within the field of engineering.\r\n\r\nIn addition to my academic pursuits, I engage in extracurricular activities that reflect my commitment to community and leadership. I volunteer at the local community center, where I assist in organizing programs aimed at improving the lives of those in our community. Furthermore, as a member of the University Debate Team, I have honed my communication and critical thinking skills, which I believe are essential for my future career trajectory.\r\n\r\nBeing a first-generation college student from a family with an annual income of $53,495, I understand the importance of education as a pathway to greater opportunities. The absence of current financial aid adds to my challenges; this scholarship is not just a financial necessity but a stepping stone that will allow me to invest more time in my studies and community service. My ultimate aim is to utilize my education to become a leader in public health, where I can harness my engineering background to contribute positively to society.\r\n\r\nI have included a reference from my academic adviser, Joseph Fischer, who can be reached at cobbrachel@davis.com for any additional information regarding my academic performance and potential. I appreciate your consideration of my application and your support of students like myself, who are striving to make a difference in their communities.\r\n\r\nThank you very much for considering my application. I am hopeful for the opportunity to further my education and to use my knowledge for the benefit of others in the field of public health.",
            "reference1": "",
            "reference1Email": "",
            "submission_time": "2025-11-04 17:09:26"
        }
    },
    {
        "task": 42,
        "model": "qwen3-vl-flash",
        "dur": 96.69513297080994,
        "step": 21,
        "result": {
            "firstName": "Clifford",
            "middleName": "Kimberly",
            "lastName": "Davis",
            "studentId": 72237130,
            "gpa": 2.7,
            "major": "Chemistry",
            "academicYear": "freshman",
            "financialAid": "Grants",
            "familyIncome": 97552,
            "achievements": [
                "Winning the State Physics Olympiad",
                " being on the Dean's List",
                " and being a finalist in the National Robotics Championship. Published a research paper in the International Journal of Engineering."
            ],
            "extracurricular": [
                "Co-founder of the Campus Startup Initiative",
                " member of the University Debate Team",
                " coordinator of the Youth Empowerment Program. Organized charity events for the Red Cross."
            ],
            "essay": "My name is Clifford Kimberly Davis, and I am currently a freshman majoring in Chemistry with a Student ID of 72237130. I am writing to express my enthusiasm for the opportunity to apply for the scholarship to support my academic journey. I have maintained a GPA of 2.7 and am the recipient of various academic accolades such as winning the State Physics Olympiad, being on the Dean's List for outstanding academic performance, and being a finalist in the National Robotics Championship. Additionally, I have published a research paper in the International Journal of Engineering, showcasing my dedication to academic excellence in the field of Chemistry. Beyond my academic achievements, I am actively engaged in extracurricular activities that demonstrate my leadership skills and commitment to community service. I am the co-founder of the Campus Startup Initiative, a member of the University Debate Team, and the coordinator of the Youth Empowerment Program. I have also organized charity events for the Red Cross, highlighting my dedication to social impact and community development. With an annual family income of $97,552, I currently rely on grants for financial aid. This scholarship would alleviate the financial burden of pursuing higher education and allow me to focus entirely on my studies and extracurricular commitments. My passion lies in advancing my knowledge in environmental science to make a meaningful impact in sustainable development. I am dedicated to utilizing the knowledge and skills gained from my studies to contribute positively to society. I have included Professor Christopher Dalton as my academic reference, and he can be contacted at pamela16@gmail.com to provide further insight into my academic abilities and character. I am grateful for your consideration of my application and look forward to the opportunity to further my education with your support.",
            "reference1": "",
            "reference1Email": "",
            "submission_time": "2025-11-04 17:11:13"
        }
    },
    {
        "task": 43,
        "model": "qwen3-vl-flash",
        "dur": 110.40386891365051,
        "step": 20,
        "result": {
            "firstName": "Lori",
            "middleName": "David",
            "lastName": "Thomas",
            "studentId": 49060860,
            "gpa": 3.25,
            "major": "History",
            "academicYear": "freshman",
            "financialAid": "None",
            "familyIncome": "$98,472",
            "achievements": [
                "Won first place in the University Math Competition and was crowned winner of the National Science Fair"
            ],
            "extracurricular": [
                "Volunteer at the local community center",
                " organize charity events for the Red Cross",
                " and serve as the coordinator of the Youth Empowerment Program."
            ],
            "essay": "Dear Scholarship Committee,\r\n\r\nMy name is Lori David Thomas, and I am currently a freshman majoring in History with a GPA of 3.25. I am writing to express my sincere interest in applying for the Environmental Science Scholarship program.\r\n\r\nAs a dedicated student with a strong passion for advancing my knowledge in environmental science, I believe that this scholarship opportunity will enable me to continue my studies without the burden of financial constraints. Growing up in a family with an annual income of $98,472 and no current financial aid, I understand the importance of financial support in pursuing higher education.\r\n\r\nThroughout my academic journey, I have been fortunate to achieve notable successes, such as winning first place in the University Math Competition and being crowned the winner of the National Science Fair. These achievements have not only reinforced my passion for science but have also demonstrated my dedication and commitment to academic excellence.\r\n\r\nIn addition to my academic accomplishments, I actively engage in extracurricular activities that align with my interests and values. I volunteer at the local community center, organize charity events for the Red Cross, and serve as the coordinator of the Youth Empowerment Program. These experiences have allowed me to develop leadership skills, foster a sense of social responsibility, and make a positive impact in my community.\r\n\r\nWith the support of this scholarship, I aspire to further my knowledge in environmental science and contribute to the field of sustainable development. I am confident that my academic background, coupled with my extracurricular involvement and strong work ethic, will allow me to excel in the program.\r\n\r\nI have enclosed a statement of purpose outlining my goals and aspirations in the field of environmental science. Additionally, Mr. Jerry Mason has kindly agreed to serve as my academic reference. For any further inquiries, please feel free to contact him at krodriguez@hotmail.com.\r\n\r\nI am immensely grateful for your consideration of my application and the opportunity to be considered for the Environmental Science Scholarship program. Thank you for your time and support.\r\n\r\nSincerely,\r\nLori David Thomas\r\n(Student ID: 49060860)",
            "reference1": "",
            "reference1Email": "",
            "submission_time": "2025-11-04 17:13:10"
        }
    },
    {
        "task": 44,
        "model": "qwen3-vl-flash",
        "dur": 99.03707599639893,
        "step": 21,
        "result": {
            "firstName": "Jenny",
            "middleName": "Christopher",
            "lastName": "Jones",
            "studentId": 62092463,
            "gpa": 3.25,
            "major": "Physics",
            "academicYear": "senior",
            "financialAid": "None",
            "familyIncome": 83081,
            "achievements": [
                "First place in the University Math Competition",
                " Top 5% in the International Chemistry Olympiad"
            ],
            "extracurricular": [
                "Co-founder of the Campus Startup Initiative",
                " Member of the Environmental Awareness Club"
            ],
            "essay": "Dear Scholarship Committee,\r\n\r\nMy name is Jenny Christopher Jones, a senior Physics major with a current GPA of 3.25 at your esteemed institution. I am writing to express my enthusiasm for the scholarship opportunity that would not only alleviate financial burdens but also propel me towards achieving my academic and career goals.\r\n\r\nAs a dedicated student in the field of Physics, I have consistently strived for excellence and have been recognized for my strong academic performance. Notably, I have achieved first place in the University Math Competition and ranked in the top 5% in the International Chemistry Olympiad. These achievements reflect my commitment to academic success and my passion for the sciences.\r\n\r\nOutside of academics, I am actively involved in extracurricular activities that allow me to make a positive impact on campus and in the community. I am a co-founder of the Campus Startup Initiative, where I have honed my leadership and entrepreneurial skills. Additionally, I am a member of the Environmental Awareness Club, where I advocate for sustainable practices and environmental conservation.\r\n\r\nDespite my academic and extracurricular commitments, I do not receive any financial aid and come from a family with an annual income of $83,081. This scholarship would provide much-needed support, enabling me to focus on my studies and complete my degree without the added stress of financial constraints. With this assistance, I will be able to pursue my passion for data science and contribute to solving global challenges through innovative research and analysis.\r\n\r\nI am confident that with your support, I will be able to achieve my academic and career aspirations. I have attached a statement of purpose outlining my goals and ambitions in the field of data science. Furthermore, Lori Crawford, my academic reference, can attest to my dedication and potential for success in this field. You may reach out to her at ychase@jones-hampton.com for any additional information.\r\n\r\nThank you for considering my application. I am eager to continue my academic journey and make a difference in the world through my contributions to the field of data science.\r\n\r\nSincerely,\r\nJenny Christopher Jones\r\nStudent ID: 62092463",
            "reference1": "",
            "reference1Email": "",
            "submission_time": "2025-11-04 17:14:56"
        }
    },
    {
        "task": 45,
        "model": "qwen3-vl-flash",
        "dur": 78.94506430625916,
        "step": 13,
        "result": {
            "firstName": "Debra",
            "middleName": "Lindsey",
            "lastName": "Collier",
            "studentId": 51082916,
            "gpa": 3.24,
            "major": "Economics",
            "academicYear": "junior",
            "financialAid": "Grants",
            "familyIncome": "$60,362",
            "achievements": [
                "Winner of the State Physics Olympiad",
                " Dean\u2019s List Award for Outstanding Academic Performance",
                " Finalist in the National Robotics Championship",
                " Winner of the National Science Fair"
            ],
            "extracurricular": [
                "Volunteered at the local community center",
                " Coordinator of the Youth Empowerment Program",
                " Member of the University Debate Team",
                " President of the Student Council"
            ],
            "essay": "Dear Selection Committee,\r\n\r\nMy name is Debra Lindsey Collier, and I am currently a Junior majoring in Economics with a strong passion for environmental science. I am writing to apply for the scholarship opportunity to further my studies and make a positive impact in sustainable development.\r\n\r\nAs a dedicated student at this esteemed institution, I have maintained a GPA of 3.24 while being actively engaged in both academic and extracurricular activities. My academic achievements include being the winner of the State Physics Olympiad, receiving the Dean\u2019s List Award for Outstanding Academic Performance, being a finalist in the National Robotics Championship, and winning the National Science Fair. These accomplishments reflect my commitment to excellence in my studies.\r\n\r\nBeyond academics, I believe in giving back to the community. I have volunteered at the local community center and served as the Coordinator of the Youth Empowerment Program. I am also a proud member of the University Debate Team and currently hold the position of President of the Student Council. These experiences have allowed me to develop leadership skills and a sense of responsibility towards creating positive change in society.\r\n\r\nThrough this scholarship, I hope to alleviate the financial burdens that come with pursuing higher education. With an annual family income of $60,362 and current financial aid in the form of grants, this scholarship would greatly support my academic journey and enable me to focus on my studies and research in the field of environmental science.\r\n\r\nMy academic reference, John Cooley, can attest to my dedication, hard work, and passion for learning. You may reach out to him via email at elizabethmunoz@yahoo.com for any recommendations about my character and academic abilities.\r\n\r\nIn conclusion, I am deeply committed to expanding my knowledge in environmental science and utilizing that knowledge to contribute positively to sustainable development. This scholarship would not only support my academic pursuits but also enable me to work towards a brighter and more sustainable future.\r\n\r\nThank you for considering my application.\r\n\r\nSincerely,\r\nDebra Lindsey Collier\r\nStudent ID: 51082916\r\nMajor/Field of Study: Economics\r\nAcademic Year: Junior",
            "reference1": "",
            "reference1Email": "",
            "submission_time": "2025-11-04 17:16:16"
        }
    },
    {
        "task": 46,
        "model": "qwen3-vl-flash",
        "dur": 115.00935983657837,
        "step": 19,
        "result": {
            "firstName": "William",
            "middleName": "Sydney",
            "lastName": "Graves",
            "studentId": 68220555,
            "gpa": 3.12,
            "major": "Biology",
            "academicYear": "senior",
            "financialAid": "None",
            "familyIncome": 37761,
            "achievements": [
                "First place in the University Math Competition",
                " Finalist in the National Robotics Championship",
                " Winner of the National Science Fair"
            ],
            "extracurricular": [
                "Coordinator of the Youth Empowerment Program",
                " Organized charity events for the Red Cross",
                " Dedicated member of the University Debate Team"
            ],
            "essay": "Dear Scholarship Committee,\r\n\r\nMy name is William Sydney Graves, and I am currently pursuing a major in Biology as a Senior at your esteemed university. My Student ID is 68220555, and I am thrilled to submit my application for the scholarship opportunity being offered.\r\n\r\nI am proud to share that I have maintained a commendable GPA of 3.12 throughout my academic journey. Despite facing financial challenges, I have not received any current financial aid, and my family's annual income is $37,761. However, I have been fortunate enough to achieve notable academic success, including securing first place in the University Math Competition, being a finalist in the National Robotics Championship, and winning the National Science Fair. These achievements have not only boosted my confidence but have also inspired me to strive for excellence in my field of study.\r\n\r\nIn addition to my academic accomplishments, I am actively involved in various extracurricular activities. As the Coordinator of the Youth Empowerment Program, I have had the privilege of making a positive impact on the lives of young individuals in our community. Furthermore, I have organized charity events for the Red Cross and have been a dedicated member of the University Debate Team. These experiences have nurtured my leadership skills, teamwork abilities, and passion for serving others.\r\n\r\nI am particularly excited about the opportunity to further my education and conduct research in cutting-edge technologies, with a specific interest in computer engineering. This scholarship would not only alleviate my financial burden but also provide me with the resources needed to pursue my academic and career goals. My long-term ambition is to innovate in the tech industry and contribute towards advancements that benefit society as a whole.\r\n\r\nI am fortunate to have an academic reference from Alfred Stark, whose guidance and mentorship have been invaluable to me. Should you require any further information or verification, please feel free to contact Mr. Stark at whenderson@ramsey-stevens.biz.\r\n\r\nIn conclusion, I am sincerely grateful for your consideration of my application. I am confident that this scholarship will enable me to continue my academic journey and make meaningful contributions to the field of Biology. Thank you for your time and attention.\r\n\r\nWarm regards,\r\nWilliam Sydney Graves",
            "reference1": "",
            "reference1Email": "",
            "submission_time": "2025-11-04 17:18:22"
        }
    },
    {
        "task": 47,
        "model": "qwen3-vl-flash",
        "dur": 98.38785696029663,
        "step": 20,
        "result": {
            "firstName": "Bradley",
            "middleName": "Neil",
            "lastName": "Hill",
            "studentId": 49532707,
            "gpa": 3.96,
            "major": "Education",
            "academicYear": "senior",
            "financialAid": "None",
            "familyIncome": "$96,495",
            "achievements": [
                "Dean\u2019s List Award for Outstanding Academic Performance",
                " Finalist in the National Robotics Championship",
                " Published research paper in the International Journal of Engineering"
            ],
            "extracurricular": [
                "President of the Student Council",
                " Organized charity events with Red Cross",
                " Volunteer at local community center mentoring younger individuals"
            ],
            "essay": "I am writing to express my sincere interest in the scholarship opportunity available for students pursuing a career in Education. My name is Bradley Neil Hill, and as a senior with a GPA of 3.96, I have committed myself to excelling academically while fully engaging in my university community. Throughout my academic journey, I have been honored to receive the Dean\u2019s List Award for Outstanding Academic Performance, which reflects my dedication and hard work. Moreover, I was a finalist in the National Robotics Championship, an experience that not only challenged my technical skills but also kindled my interest in collaborative problem-solving and innovative thinking. Additionally, I have contributed to the field through a published research paper in the International Journal of Engineering, demonstrating my capability to engage seriously with pertinent issues. Beyond academics, I take great pride in being actively involved in extracurricular activities that foster community and leadership. As the President of the Student Council, I have honed my leadership skills, working collaboratively with peers to operationalize our ideas and serve the student body effectively. One of my proudest achievements was organizing various charity events in partnership with the Red Cross, where we successfully raised funds and awareness for pressing community needs. Furthermore, as a volunteer at the local community center, I have had the privilege of giving back and mentoring younger individuals, cultivating a passion for educational development that mirrors my own life\u2019s purpose. Even as I balance these responsibilities, I uphold a clear vision of my future in education. My statement of purpose revolves around my deep passion for advancing knowledge in environmental science and its implications for sustainable development. I believe this scholarship will relieve the financial burdens that can hinder academic focus, thus allowing me to immerse myself completely in my studies. The knowledge and experience gained will be pivotal as I aspire to make significant contributions towards educating future generations on sustainability and responsible environmental stewardship. I am excited about the opportunity this scholarship represents, not just for my academic pursuits, but for the tangible impact I can make in my community and beyond. I am committed to leveraging my education for the betterment of society, nurturing an informed populace that cares for our planet. For academic reference, I have provided the details of Richard Clay, who can be reached at atkinsonjohn@gmail.com. His insights can speak to my academic rigor and my dedication towards my field of study. Thank you for considering my application. I eagerly await the possibilities this scholarship can unfold.",
            "reference1": "",
            "reference1Email": "",
            "submission_time": "2025-11-04 17:20:01"
        }
    },
    {
        "task": 48,
        "model": "qwen3-vl-flash",
        "dur": 72.64090394973755,
        "step": 14,
        "result": {
            "firstName": "Ryan",
            "middleName": "Amanda",
            "lastName": "Miller",
            "studentId": 19718370,
            "gpa": 3.07,
            "major": "Art",
            "academicYear": "senior",
            "financialAid": "Student Loans",
            "familyIncome": 66896,
            "achievements": [
                "Winner of the National Science Fair and Finalist in the National Robotics Championship"
            ],
            "extracurricular": [
                "Member of the University Debate Team",
                " organized charity events for the Red Cross",
                " Coordinator of the Youth Empowerment Program"
            ],
            "essay": "Dear Scholarship Committee,\\n\\nMy name is Ryan Amanda Miller, and I am a Senior student majoring in Art at your esteemed institution. I am writing to apply for the scholarship opportunity to support my academic pursuits.\\n\\nAs a first-generation college student, navigating the challenges of higher education has been both rewarding and challenging. Despite these obstacles, I have maintained a GPA of 3.07 and have actively participated in various extracurricular activities, such as being a member of the University Debate Team, organizing charity events for the Red Cross, and serving as the Coordinator of the Youth Empowerment Program. These experiences have not only enriched my college experience but have also taught me invaluable leadership and teamwork skills.\\n\\nIn addition to my academic accomplishments, I have also achieved recognition for my work outside the classroom. I was honored to be the Winner of the National Science Fair and a Finalist in the National Robotics Championship. These achievements have not only highlighted my dedication to academic excellence but have also fueled my passion for innovative thinking and problem-solving.\\n\\nDespite my current financial situation, which is primarily supported by student loans and an annual family income of $66,896, I have remained committed to my education and community service efforts. However, the financial burden is becoming increasingly challenging, and I believe that receiving this scholarship would greatly alleviate the financial stress, allowing me to focus more on my studies and community involvement.\\n\\nMy ultimate goal is to become a leader in public health and make a positive impact on society. This scholarship would bring me one step closer to realizing that dream by enabling me to pursue higher education without the constant worry about financial difficulties. I am confident that with your support, I will continue to excel academically while contributing meaningfully to the community.\\n\\nI am grateful for your time and consideration. I have provided my academic reference, Robert Hill, whose email is monica01@luna.com, for any further information you may require. Thank you for the opportunity to apply for this scholarship, and I look forward to the possibility of continuing my education with your support.\\n\\nSincerely,\\nRyan Amanda Miller\\n(Student ID: 19718370)",
            "reference1": "Robert Hill",
            "reference1Email": "monica01@luna.com",
            "submission_time": "2025-11-04 17:21:18"
        }
    },
    {
        "task": 49,
        "model": "qwen3-vl-flash",
        "dur": 107.23220610618591,
        "step": 18,
        "result": {
            "firstName": "Shelly",
            "middleName": "Krista",
            "lastName": "Larson",
            "studentId": 20623406,
            "gpa": 3.03,
            "major": "History",
            "academicYear": "sophomore",
            "financialAid": "Grants",
            "familyIncome": 34126,
            "achievements": [
                "I am a sophomore majoring in History with a current GPA of 3.03. I have consistently strived for academic excellence while balancing my studies with various extracurricular activities. I was a finalist in the National Robotics Championship",
                " published a research paper in the International Journal of Engineering",
                " won the National Science Fair",
                " and was awarded the Dean's List Award for Outstanding Academic Performance."
            ],
            "extracurricular": [
                "I have organized charity events for the Red Cross and am a member of the Environmental Awareness Club",
                " demonstrating my commitment to giving back to my community and fostering environmental sustainability."
            ],
            "essay": "Dear Scholarship Committee,\r\n\r\nMy name is Shelly Krista Larson, and I am currently a sophomore majoring in History. I am writing to apply for the scholarship opportunity to further my education and pursue my passion for computer engineering.\r\n\r\nAs a student with a current GPA of 3.03, I have consistently strived for academic excellence while balancing my studies with various extracurricular activities. Despite my major in History, I have excelled in STEM-related fields, as evidenced by being a finalist in the National Robotics Championship and publishing a research paper in the International Journal of Engineering. Additionally, I have received recognition for my academic achievements, such as winning the National Science Fair and being awarded the Dean's List Award for Outstanding Academic Performance.\r\n\r\nWhile my current financial aid consists of grants and my family's annual income is $34,126, this scholarship would provide invaluable support towards my educational goals. The scholarship would enable me to access resources to conduct research in cutting-edge technologies, aligning with my long-term career aspirations of innovating in the tech industry.\r\n\r\nIn addition to my academic achievements, I actively engage in extracurricular activities that contribute to my personal growth and development. I have organized charity events for the Red Cross and am a member of the Environmental Awareness Club, demonstrating my commitment to giving back to my community and fostering environmental sustainability.\r\n\r\nI am grateful for the opportunity to provide Academic Reference, Albert Ewing, who can attest to my academic abilities and dedication to my field of study. You may contact him at hicksjames@gmail.com for any further information regarding my academic qualifications and achievements.\r\n\r\nIn conclusion, I am confident that receiving this scholarship would be instrumental in realizing my academic and career aspirations in computer engineering. I am dedicated, driven, and passionate about making a meaningful impact in the tech industry, and I believe that this scholarship will empower me to achieve my goals.\r\n\r\nThank you for considering my application.\r\n\r\nSincerely,\r\nShelly Krista Larson\r\nStudent ID: 20623406",
            "reference1": "",
            "reference1Email": "",
            "submission_time": "2025-11-04 17:23:17"
        }
    }
]